[
  {
    "note_id": "NOTE00001",
    "patient_name": "Daniel Martin",
    "patient_age": 77,
    "patient_gender": "Male",
    "encounter_date": "2024-04-14T01:17:14.908948",
    "encounter_type": "Orthopedic Follow-up",
    "chief_complaint": "chronic knee/hip pain",
    "medical_history": "reports joint pain and stiffness, worse in morning, improves with activity",
    "bp_systolic": 137,
    "bp_diastolic": 84,
    "temperature_f": 97.7,
    "weight_lbs": 194,
    "heart_rate": 81,
    "vitals_text": "BP 137/84 | Temp 97.7 \u00b0F | Wt 194 lb | HR 81",
    "physical_exam": "joint crepitus noted, mild effusion, reduced range of motion, no erythema",
    "lab_results": "X-ray shows joint space narrowing and osteophyte formation",
    "assessment": "Osteoarthritis of knee/hip",
    "icd10_codes": "M17.11, M16.11",
    "diagnosis_summary": "Osteoarthritis of knee/hip",
    "treatment_plan": "Medications: celecoxib 200 mg daily, acetaminophen 1000 mg TID, glucosamine 1500 mg daily. Follow-up in 16 weeks.",
    "medications_prescribed": "celecoxib 200 mg daily, acetaminophen 1000 mg TID, glucosamine 1500 mg daily",
    "procedures_planned": "",
    "referrals": "",
    "follow_up_weeks": 16,
    "full_clinical_note": "Daniel Martin, a 77-year-old male, presents today for chronic knee/hip pain. The patient reports joint pain and stiffness, worse in morning, improves with activity. Personal, social, and family histories have been reviewed and updated in EMR. BP 137/84 | Temp 97.7 \u00b0F | Wt 194 lb | HR 81. Physical exam reveals joint crepitus noted, mild effusion, reduced range of motion, no erythema. Labs show X-ray shows joint space narrowing and osteophyte formation. Assessment: Osteoarthritis of knee/hip (M17.11, M16.11). Plan: Prescribe celecoxib 200 mg daily, acetaminophen 1000 mg TID, and glucosamine 1500 mg daily. Follow up in 16 weeks.",
    "provider_name": "Dr. Brown",
    "department": "Pulmonology",
    "note_status": "FINAL",
    "created_at": "2024-04-14T01:17:14.908948",
    "updated_at": "2024-04-14T01:17:14.908948"
  },
  {
    "note_id": "NOTE00002",
    "patient_name": "Robert Jones",
    "patient_age": 39,
    "patient_gender": "Male",
    "encounter_date": "2023-11-30T01:17:14.909023",
    "encounter_type": "Mental Health Follow-up",
    "chief_complaint": "follow-up on anxiety and depression",
    "medical_history": "mentions worsening anxiety episodes triggered by work stress, denies suicidal ideation",
    "bp_systolic": 110,
    "bp_diastolic": 80,
    "temperature_f": 98.5,
    "weight_lbs": 169,
    "heart_rate": 78,
    "vitals_text": "BP 110/80 | Temp 98.5 \u00b0F | Wt 169 lb | HR 78",
    "physical_exam": "no acute distress, engages cooperatively in conversation, appropriate affect",
    "lab_results": "PHQ-9 score: 10-16 (moderate depression), GAD-7 score: 8-12 (mild-moderate anxiety)",
    "assessment": "Major depressive disorder, Generalized anxiety disorder",
    "icd10_codes": "F33.1, F41.1",
    "diagnosis_summary": "Major depressive disorder, Generalized anxiety disorder",
    "treatment_plan": "Medications: sertraline 50-150 mg daily. Follow-up in 4 weeks.",
    "medications_prescribed": "sertraline 50-150 mg daily",
    "procedures_planned": "",
    "referrals": "",
    "follow_up_weeks": 4,
    "full_clinical_note": "Robert Jones, a 39-year-old male, presents today for follow-up on anxiety and depression. The patient mentions worsening anxiety episodes triggered by work stress, denies suicidal ideation. Personal, social, and family histories have been reviewed and updated in EMR. BP 110/80 | Temp 98.5 \u00b0F | Wt 169 lb | HR 78. Physical exam reveals no acute distress, engages cooperatively in conversation, appropriate affect. Labs show PHQ-9 score: 10-16 (moderate depression), GAD-7 score: 8-12 (mild-moderate anxiety). Assessment: Major depressive disorder, Generalized anxiety disorder (F33.1, F41.1). Plan: Prescribe sertraline 50-150 mg daily. Follow up in 4 weeks.",
    "provider_name": "Dr. Johnson",
    "department": "Internal Medicine",
    "note_status": "FINAL",
    "created_at": "2023-11-30T01:17:14.909023",
    "updated_at": "2023-11-30T01:17:14.909023"
  },
  {
    "note_id": "NOTE00003",
    "patient_name": "Michelle Davis",
    "patient_age": 65,
    "patient_gender": "Female",
    "encounter_date": "2025-08-27T01:17:14.909047",
    "encounter_type": "Pre-operative Visit",
    "chief_complaint": "pre-surgical evaluation",
    "medical_history": "scheduled for elective surgery, no recent illnesses",
    "bp_systolic": 117,
    "bp_diastolic": 77,
    "temperature_f": 98.5,
    "weight_lbs": 217,
    "heart_rate": 80,
    "vitals_text": "BP 117/77 | Temp 98.5 \u00b0F | Wt 217 lb | HR 80",
    "physical_exam": "general health good, cardiovascular and pulmonary systems stable",
    "lab_results": "CBC, CMP, PT/INR within normal limits",
    "assessment": "Pre-operative evaluation",
    "icd10_codes": "Z01.818",
    "diagnosis_summary": "Pre-operative evaluation",
    "treatment_plan": "Medications: Continue home medications, Hold aspirin 7 days prior. Follow-up in 1 weeks.",
    "medications_prescribed": "Continue home medications, Hold aspirin 7 days prior",
    "procedures_planned": "",
    "referrals": "",
    "follow_up_weeks": 1,
    "full_clinical_note": "Michelle Davis, a 65-year-old female, presents today for pre-surgical evaluation. The patient scheduled for elective surgery, no recent illnesses. Personal, social, and family histories have been reviewed and updated in EMR. BP 117/77 | Temp 98.5 \u00b0F | Wt 217 lb | HR 80. Physical exam reveals general health good, cardiovascular and pulmonary systems stable. Labs show CBC, CMP, PT/INR within normal limits. Assessment: Pre-operative evaluation (Z01.818). Plan: Prescribe Continue home medications, and Hold aspirin 7 days prior. Follow up in 1 weeks.",
    "provider_name": "Dr. Williams",
    "department": "Cardiology",
    "note_status": "FINAL",
    "created_at": "2025-08-27T01:17:14.909047",
    "updated_at": "2025-08-27T01:17:14.909047"
  },
  {
    "note_id": "NOTE00004",
    "patient_name": "Andrew Harris",
    "patient_age": 48,
    "patient_gender": "Male",
    "encounter_date": "2025-08-25T01:17:14.909065",
    "encounter_type": "Mental Health Follow-up",
    "chief_complaint": "follow-up on anxiety and depression",
    "medical_history": "mentions worsening anxiety episodes triggered by work stress, denies suicidal ideation",
    "bp_systolic": 129,
    "bp_diastolic": 75,
    "temperature_f": 98.3,
    "weight_lbs": 149,
    "heart_rate": 65,
    "vitals_text": "BP 129/75 | Temp 98.3 \u00b0F | Wt 149 lb | HR 65",
    "physical_exam": "no acute distress, engages cooperatively in conversation, appropriate affect",
    "lab_results": "PHQ-9 score: 10-16 (moderate depression), GAD-7 score: 8-12 (mild-moderate anxiety)",
    "assessment": "Major depressive disorder, Generalized anxiety disorder",
    "icd10_codes": "F33.1, F41.1",
    "diagnosis_summary": "Major depressive disorder, Generalized anxiety disorder",
    "treatment_plan": "Medications: sertraline 50-150 mg daily, hydroxyzine 25 mg PRN anxiety, buspirone 15 mg BID. Follow-up in 4 weeks.",
    "medications_prescribed": "sertraline 50-150 mg daily, hydroxyzine 25 mg PRN anxiety, buspirone 15 mg BID",
    "procedures_planned": "",
    "referrals": "",
    "follow_up_weeks": 4,
    "full_clinical_note": "Andrew Harris, a 48-year-old male, presents today for follow-up on anxiety and depression. The patient mentions worsening anxiety episodes triggered by work stress, denies suicidal ideation. Personal, social, and family histories have been reviewed and updated in EMR. BP 129/75 | Temp 98.3 \u00b0F | Wt 149 lb | HR 65. Physical exam reveals no acute distress, engages cooperatively in conversation, appropriate affect. Labs show PHQ-9 score: 10-16 (moderate depression), GAD-7 score: 8-12 (mild-moderate anxiety). Assessment: Major depressive disorder, Generalized anxiety disorder (F33.1, F41.1). Plan: Prescribe sertraline 50-150 mg daily, hydroxyzine 25 mg PRN anxiety, and buspirone 15 mg BID. Follow up in 4 weeks.",
    "provider_name": "Dr. Brown",
    "department": "Cardiology",
    "note_status": "FINAL",
    "created_at": "2025-08-25T01:17:14.909065",
    "updated_at": "2025-08-25T01:17:14.909065"
  },
  {
    "note_id": "NOTE00005",
    "patient_name": "Paul Lewis",
    "patient_age": 42,
    "patient_gender": "Male",
    "encounter_date": "2024-10-24T01:17:14.909080",
    "encounter_type": "Neurology Follow-up",
    "chief_complaint": "recurrent migraine headaches",
    "medical_history": "reports 3-5 headaches per month, photophobia and nausea with attacks",
    "bp_systolic": 126,
    "bp_diastolic": 72,
    "temperature_f": 98.2,
    "weight_lbs": 146,
    "heart_rate": 70,
    "vitals_text": "BP 126/72 | Temp 98.2 \u00b0F | Wt 146 lb | HR 70",
    "physical_exam": "neurological exam normal, no focal deficits",
    "lab_results": "No labs indicated, clinical diagnosis",
    "assessment": "Migraine without aura",
    "icd10_codes": "G43.009",
    "diagnosis_summary": "Migraine without aura",
    "treatment_plan": "Medications: topiramate 50 mg BID, propranolol 80 mg daily. Follow-up in 16 weeks.",
    "medications_prescribed": "topiramate 50 mg BID, propranolol 80 mg daily",
    "procedures_planned": "",
    "referrals": "",
    "follow_up_weeks": 16,
    "full_clinical_note": "Paul Lewis, a 42-year-old male, presents today for recurrent migraine headaches. The patient reports 3-5 headaches per month, photophobia and nausea with attacks. Personal, social, and family histories have been reviewed and updated in EMR. BP 126/72 | Temp 98.2 \u00b0F | Wt 146 lb | HR 70. Physical exam reveals neurological exam normal, no focal deficits. Assessment: Migraine without aura (G43.009). Plan: Prescribe topiramate 50 mg BID, and propranolol 80 mg daily. Follow up in 16 weeks.",
    "provider_name": "Dr. Williams",
    "department": "Family Medicine",
    "note_status": "FINAL",
    "created_at": "2024-10-24T01:17:14.909080",
    "updated_at": "2024-10-24T01:17:14.909080"
  },
  {
    "note_id": "NOTE00006",
    "patient_name": "Donna Williams",
    "patient_age": 24,
    "patient_gender": "Female",
    "encounter_date": "2023-12-06T01:17:14.909095",
    "encounter_type": "Pulmonary Follow-up",
    "chief_complaint": "follow-up for asthma management",
    "medical_history": "reports occasional wheezing during colds, uses rescue inhaler 2-3 times per week",
    "bp_systolic": 124,
    "bp_diastolic": 76,
    "temperature_f": 97.8,
    "weight_lbs": 119,
    "heart_rate": 74,
    "vitals_text": "BP 124/76 | Temp 97.8 \u00b0F | Wt 119 lb | HR 74",
    "physical_exam": "lung auscultation reveals occasional expiratory wheezes, no respiratory distress",
    "lab_results": "Peak flow: 75-85% of predicted, spirometry shows mild obstruction",
    "assessment": "Moderate persistent asthma",
    "icd10_codes": "J45.40",
    "diagnosis_summary": "Moderate persistent asthma",
    "treatment_plan": "Medications: albuterol inhaler PRN, fluticasone/salmeterol 250/50 mcg BID, montelukast 10 mg daily. Follow-up in 24 weeks.",
    "medications_prescribed": "albuterol inhaler PRN, fluticasone/salmeterol 250/50 mcg BID, montelukast 10 mg daily",
    "procedures_planned": "",
    "referrals": "",
    "follow_up_weeks": 24,
    "full_clinical_note": "Donna Williams, a 24-year-old female, presents today for follow-up for asthma management. The patient reports occasional wheezing during colds, uses rescue inhaler 2-3 times per week. Personal, social, and family histories have been reviewed and updated in EMR. BP 124/76 | Temp 97.8 \u00b0F | Wt 119 lb | HR 74. Physical exam reveals lung auscultation reveals occasional expiratory wheezes, no respiratory distress. Labs show Peak flow: 75-85% of predicted, spirometry shows mild obstruction. Assessment: Moderate persistent asthma (J45.40). Plan: Prescribe albuterol inhaler PRN, fluticasone/salmeterol 250/50 mcg BID, and montelukast 10 mg daily. Follow up in 24 weeks.",
    "provider_name": "Dr. Williams",
    "department": "Family Medicine",
    "note_status": "FINAL",
    "created_at": "2023-12-06T01:17:14.909095",
    "updated_at": "2023-12-06T01:17:14.909095"
  },
  {
    "note_id": "NOTE00007",
    "patient_name": "Donald Lewis",
    "patient_age": 17,
    "patient_gender": "Male",
    "encounter_date": "2024-02-29T01:17:14.909110",
    "encounter_type": "Pulmonary Follow-up",
    "chief_complaint": "follow-up for asthma management",
    "medical_history": "reports occasional wheezing during colds, uses rescue inhaler 2-3 times per week",
    "bp_systolic": 115,
    "bp_diastolic": 76,
    "temperature_f": 97.5,
    "weight_lbs": 150,
    "heart_rate": 88,
    "vitals_text": "BP 115/76 | Temp 97.5 \u00b0F | Wt 150 lb | HR 88",
    "physical_exam": "lung auscultation reveals occasional expiratory wheezes, no respiratory distress",
    "lab_results": "Peak flow: 75-85% of predicted, spirometry shows mild obstruction",
    "assessment": "Moderate persistent asthma",
    "icd10_codes": "J45.40",
    "diagnosis_summary": "Moderate persistent asthma",
    "treatment_plan": "Medications: fluticasone/salmeterol 250/50 mcg BID. Follow-up in 16 weeks.",
    "medications_prescribed": "fluticasone/salmeterol 250/50 mcg BID",
    "procedures_planned": "",
    "referrals": "",
    "follow_up_weeks": 16,
    "full_clinical_note": "Donald Lewis, a 17-year-old male, presents today for follow-up for asthma management. The patient reports occasional wheezing during colds, uses rescue inhaler 2-3 times per week. Personal, social, and family histories have been reviewed and updated in EMR. BP 115/76 | Temp 97.5 \u00b0F | Wt 150 lb | HR 88. Physical exam reveals lung auscultation reveals occasional expiratory wheezes, no respiratory distress. Labs show Peak flow: 75-85% of predicted, spirometry shows mild obstruction. Assessment: Moderate persistent asthma (J45.40). Plan: Prescribe fluticasone/salmeterol 250/50 mcg BID. Follow up in 16 weeks.",
    "provider_name": "Dr. Williams",
    "department": "Pulmonology",
    "note_status": "FINAL",
    "created_at": "2024-02-29T01:17:14.909110",
    "updated_at": "2024-02-29T01:17:14.909110"
  },
  {
    "note_id": "NOTE00008",
    "patient_name": "Linda Anderson",
    "patient_age": 16,
    "patient_gender": "Female",
    "encounter_date": "2025-01-15T01:17:14.909121",
    "encounter_type": "Pulmonary Follow-up",
    "chief_complaint": "follow-up for asthma management",
    "medical_history": "reports occasional wheezing during colds, uses rescue inhaler 2-3 times per week",
    "bp_systolic": 105,
    "bp_diastolic": 80,
    "temperature_f": 97.6,
    "weight_lbs": 157,
    "heart_rate": 70,
    "vitals_text": "BP 105/80 | Temp 97.6 \u00b0F | Wt 157 lb | HR 70",
    "physical_exam": "lung auscultation reveals occasional expiratory wheezes, no respiratory distress",
    "lab_results": "Peak flow: 75-85% of predicted, spirometry shows mild obstruction",
    "assessment": "Moderate persistent asthma",
    "icd10_codes": "J45.40",
    "diagnosis_summary": "Moderate persistent asthma",
    "treatment_plan": "Medications: albuterol inhaler PRN. Follow-up in 12 weeks.",
    "medications_prescribed": "albuterol inhaler PRN",
    "procedures_planned": "",
    "referrals": "",
    "follow_up_weeks": 12,
    "full_clinical_note": "Linda Anderson, a 16-year-old female, presents today for follow-up for asthma management. The patient reports occasional wheezing during colds, uses rescue inhaler 2-3 times per week. Personal, social, and family histories have been reviewed and updated in EMR. BP 105/80 | Temp 97.6 \u00b0F | Wt 157 lb | HR 70. Physical exam reveals lung auscultation reveals occasional expiratory wheezes, no respiratory distress. Labs show Peak flow: 75-85% of predicted, spirometry shows mild obstruction. Assessment: Moderate persistent asthma (J45.40). Plan: Prescribe albuterol inhaler PRN. Follow up in 12 weeks.",
    "provider_name": "Dr. Johnson",
    "department": "Orthopedics",
    "note_status": "FINAL",
    "created_at": "2025-01-15T01:17:14.909121",
    "updated_at": "2025-01-15T01:17:14.909121"
  },
  {
    "note_id": "NOTE00009",
    "patient_name": "Anthony Martin",
    "patient_age": 33,
    "patient_gender": "Male",
    "encounter_date": "2024-03-29T01:17:14.909132",
    "encounter_type": "Mental Health Follow-up",
    "chief_complaint": "follow-up on anxiety and depression",
    "medical_history": "mentions worsening anxiety episodes triggered by work stress, denies suicidal ideation",
    "bp_systolic": 116,
    "bp_diastolic": 70,
    "temperature_f": 97.6,
    "weight_lbs": 135,
    "heart_rate": 76,
    "vitals_text": "BP 116/70 | Temp 97.6 \u00b0F | Wt 135 lb | HR 76",
    "physical_exam": "no acute distress, engages cooperatively in conversation, appropriate affect",
    "lab_results": "PHQ-9 score: 10-16 (moderate depression), GAD-7 score: 8-12 (mild-moderate anxiety)",
    "assessment": "Major depressive disorder, Generalized anxiety disorder",
    "icd10_codes": "F33.1, F41.1",
    "diagnosis_summary": "Major depressive disorder, Generalized anxiety disorder",
    "treatment_plan": "Medications: buspirone 15 mg BID. Follow-up in 4 weeks.",
    "medications_prescribed": "buspirone 15 mg BID",
    "procedures_planned": "",
    "referrals": "",
    "follow_up_weeks": 4,
    "full_clinical_note": "Anthony Martin, a 33-year-old male, presents today for follow-up on anxiety and depression. The patient mentions worsening anxiety episodes triggered by work stress, denies suicidal ideation. Personal, social, and family histories have been reviewed and updated in EMR. BP 116/70 | Temp 97.6 \u00b0F | Wt 135 lb | HR 76. Physical exam reveals no acute distress, engages cooperatively in conversation, appropriate affect. Labs show PHQ-9 score: 10-16 (moderate depression), GAD-7 score: 8-12 (mild-moderate anxiety). Assessment: Major depressive disorder, Generalized anxiety disorder (F33.1, F41.1). Plan: Prescribe buspirone 15 mg BID. Follow up in 4 weeks.",
    "provider_name": "Dr. Davis",
    "department": "Family Medicine",
    "note_status": "FINAL",
    "created_at": "2024-03-29T01:17:14.909132",
    "updated_at": "2024-03-29T01:17:14.909132"
  },
  {
    "note_id": "NOTE00010",
    "patient_name": "Barbara Moore",
    "patient_age": 66,
    "patient_gender": "Female",
    "encounter_date": "2024-11-12T01:17:14.909142",
    "encounter_type": "Follow-up Visit",
    "chief_complaint": "follow-up of chronic conditions",
    "medical_history": "reports compliance with medications but notes occasional headaches",
    "bp_systolic": 135,
    "bp_diastolic": 93,
    "temperature_f": 98.3,
    "weight_lbs": 250,
    "heart_rate": 75,
    "vitals_text": "BP 135/93 | Temp 98.3 \u00b0F | Wt 250 lb | HR 75",
    "physical_exam": "no acute distress, heart RRR with no murmurs, lungs clear bilaterally",
    "lab_results": "fasting glucose: 145-165 mg/dL, HbA1c: 7.5-9.0%, LDL 110-140 mg/dL, HDL 35-45 mg/dL",
    "assessment": "Essential hypertension, Type 2 diabetes",
    "icd10_codes": "I10, E11.65",
    "diagnosis_summary": "Essential hypertension, Type 2 diabetes",
    "treatment_plan": "Medications: metformin 1000 mg BID, lisinopril 10-20 mg daily. Follow-up in 8 weeks.",
    "medications_prescribed": "metformin 1000 mg BID, lisinopril 10-20 mg daily",
    "procedures_planned": "",
    "referrals": "",
    "follow_up_weeks": 8,
    "full_clinical_note": "Barbara Moore, a 66-year-old female, presents today for follow-up of chronic conditions. The patient reports compliance with medications but notes occasional headaches. Personal, social, and family histories have been reviewed and updated in EMR. BP 135/93 | Temp 98.3 \u00b0F | Wt 250 lb | HR 75. Physical exam reveals no acute distress, heart RRR with no murmurs, lungs clear bilaterally. Labs show fasting glucose: 145-165 mg/dL, HbA1c: 7.5-9.0%, LDL 110-140 mg/dL, HDL 35-45 mg/dL. Assessment: Essential hypertension, Type 2 diabetes (I10, E11.65). Plan: Prescribe metformin 1000 mg BID, and lisinopril 10-20 mg daily. Follow up in 8 weeks.",
    "provider_name": "Dr. Smith",
    "department": "Internal Medicine",
    "note_status": "FINAL",
    "created_at": "2024-11-12T01:17:14.909142",
    "updated_at": "2024-11-12T01:17:14.909142"
  },
  {
    "note_id": "NOTE00011",
    "patient_name": "Kimberly Sanchez",
    "patient_age": 25,
    "patient_gender": "Female",
    "encounter_date": "2025-03-01T01:17:14.909161",
    "encounter_type": "Mental Health Follow-up",
    "chief_complaint": "follow-up on anxiety and depression",
    "medical_history": "mentions worsening anxiety episodes triggered by work stress, denies suicidal ideation",
    "bp_systolic": 123,
    "bp_diastolic": 71,
    "temperature_f": 98.3,
    "weight_lbs": 132,
    "heart_rate": 71,
    "vitals_text": "BP 123/71 | Temp 98.3 \u00b0F | Wt 132 lb | HR 71",
    "physical_exam": "no acute distress, engages cooperatively in conversation, appropriate affect",
    "lab_results": "PHQ-9 score: 10-16 (moderate depression), GAD-7 score: 8-12 (mild-moderate anxiety)",
    "assessment": "Major depressive disorder, Generalized anxiety disorder",
    "icd10_codes": "F33.1, F41.1",
    "diagnosis_summary": "Major depressive disorder, Generalized anxiety disorder",
    "treatment_plan": "Medications: buspirone 15 mg BID. Follow-up in 4 weeks.",
    "medications_prescribed": "buspirone 15 mg BID",
    "procedures_planned": "",
    "referrals": "",
    "follow_up_weeks": 4,
    "full_clinical_note": "Kimberly Sanchez, a 25-year-old female, presents today for follow-up on anxiety and depression. The patient mentions worsening anxiety episodes triggered by work stress, denies suicidal ideation. Personal, social, and family histories have been reviewed and updated in EMR. BP 123/71 | Temp 98.3 \u00b0F | Wt 132 lb | HR 71. Physical exam reveals no acute distress, engages cooperatively in conversation, appropriate affect. Labs show PHQ-9 score: 10-16 (moderate depression), GAD-7 score: 8-12 (mild-moderate anxiety). Assessment: Major depressive disorder, Generalized anxiety disorder (F33.1, F41.1). Plan: Prescribe buspirone 15 mg BID. Follow up in 4 weeks.",
    "provider_name": "Dr. Jones",
    "department": "Pulmonology",
    "note_status": "FINAL",
    "created_at": "2025-03-01T01:17:14.909161",
    "updated_at": "2025-03-01T01:17:14.909161"
  },
  {
    "note_id": "NOTE00012",
    "patient_name": "Thomas Lewis",
    "patient_age": 79,
    "patient_gender": "Male",
    "encounter_date": "2025-04-17T01:17:14.909172",
    "encounter_type": "Cardiopulmonary Follow-up",
    "chief_complaint": "routine follow-up for COPD and heart failure",
    "medical_history": "experiences dyspnea on exertion, denies chest pain, reports mild peripheral edema",
    "bp_systolic": 133,
    "bp_diastolic": 73,
    "temperature_f": 97.8,
    "weight_lbs": 175,
    "heart_rate": 92,
    "vitals_text": "BP 133/73 | Temp 97.8 \u00b0F | Wt 175 lb | HR 92",
    "physical_exam": "bilateral crackles at lung bases, S3 heart sound, mild peripheral edema (+1 to +2)",
    "lab_results": "BNP elevated at 300-450 pg/mL, creatinine stable at 1.0-1.5 mg/dL, oxygen saturation 88-92%",
    "assessment": "CHF exacerbation, COPD",
    "icd10_codes": "I50.9, J44.9",
    "diagnosis_summary": "CHF exacerbation, COPD",
    "treatment_plan": "Medications: furosemide 40-80 mg daily, carvedilol 12.5 mg BID. Follow-up in 2 weeks.",
    "medications_prescribed": "furosemide 40-80 mg daily, carvedilol 12.5 mg BID",
    "procedures_planned": "",
    "referrals": "",
    "follow_up_weeks": 2,
    "full_clinical_note": "Thomas Lewis, a 79-year-old male, presents today for routine follow-up for COPD and heart failure. The patient experiences dyspnea on exertion, denies chest pain, reports mild peripheral edema. Personal, social, and family histories have been reviewed and updated in EMR. BP 133/73 | Temp 97.8 \u00b0F | Wt 175 lb | HR 92. Physical exam reveals bilateral crackles at lung bases, S3 heart sound, mild peripheral edema (+1 to +2). Labs show BNP elevated at 300-450 pg/mL, creatinine stable at 1.0-1.5 mg/dL, oxygen saturation 88-92%. Assessment: CHF exacerbation, COPD (I50.9, J44.9). Plan: Prescribe furosemide 40-80 mg daily, and carvedilol 12.5 mg BID. Follow up in 2 weeks.",
    "provider_name": "Dr. Johnson",
    "department": "Internal Medicine",
    "note_status": "FINAL",
    "created_at": "2025-04-17T01:17:14.909172",
    "updated_at": "2025-04-17T01:17:14.909172"
  },
  {
    "note_id": "NOTE00013",
    "patient_name": "Kenneth Jackson",
    "patient_age": 69,
    "patient_gender": "Male",
    "encounter_date": "2024-12-07T01:17:14.909183",
    "encounter_type": "Follow-up Visit",
    "chief_complaint": "follow-up of chronic conditions",
    "medical_history": "reports compliance with medications but notes occasional headaches",
    "bp_systolic": 146,
    "bp_diastolic": 95,
    "temperature_f": 97.5,
    "weight_lbs": 181,
    "heart_rate": 75,
    "vitals_text": "BP 146/95 | Temp 97.5 \u00b0F | Wt 181 lb | HR 75",
    "physical_exam": "no acute distress, heart RRR with no murmurs, lungs clear bilaterally",
    "lab_results": "fasting glucose: 145-165 mg/dL, HbA1c: 7.5-9.0%, LDL 110-140 mg/dL, HDL 35-45 mg/dL",
    "assessment": "Essential hypertension, Type 2 diabetes",
    "icd10_codes": "I10, E11.65",
    "diagnosis_summary": "Essential hypertension, Type 2 diabetes",
    "treatment_plan": "Medications: metformin 1000 mg BID, lisinopril 10-20 mg daily, atorvastatin 20 mg daily. Follow-up in 16 weeks.",
    "medications_prescribed": "metformin 1000 mg BID, lisinopril 10-20 mg daily, atorvastatin 20 mg daily",
    "procedures_planned": "",
    "referrals": "",
    "follow_up_weeks": 16,
    "full_clinical_note": "Kenneth Jackson, a 69-year-old male, presents today for follow-up of chronic conditions. The patient reports compliance with medications but notes occasional headaches. Personal, social, and family histories have been reviewed and updated in EMR. BP 146/95 | Temp 97.5 \u00b0F | Wt 181 lb | HR 75. Physical exam reveals no acute distress, heart RRR with no murmurs, lungs clear bilaterally. Labs show fasting glucose: 145-165 mg/dL, HbA1c: 7.5-9.0%, LDL 110-140 mg/dL, HDL 35-45 mg/dL. Assessment: Essential hypertension, Type 2 diabetes (I10, E11.65). Plan: Prescribe metformin 1000 mg BID, lisinopril 10-20 mg daily, and atorvastatin 20 mg daily. Follow up in 16 weeks.",
    "provider_name": "Dr. Smith",
    "department": "Family Medicine",
    "note_status": "FINAL",
    "created_at": "2024-12-07T01:17:14.909183",
    "updated_at": "2024-12-07T01:17:14.909183"
  },
  {
    "note_id": "NOTE00014",
    "patient_name": "Emily Johnson",
    "patient_age": 55,
    "patient_gender": "Female",
    "encounter_date": "2025-03-27T01:17:14.909194",
    "encounter_type": "Orthopedic Follow-up",
    "chief_complaint": "chronic knee/hip pain",
    "medical_history": "reports joint pain and stiffness, worse in morning, improves with activity",
    "bp_systolic": 138,
    "bp_diastolic": 81,
    "temperature_f": 98.3,
    "weight_lbs": 204,
    "heart_rate": 75,
    "vitals_text": "BP 138/81 | Temp 98.3 \u00b0F | Wt 204 lb | HR 75",
    "physical_exam": "joint crepitus noted, mild effusion, reduced range of motion, no erythema",
    "lab_results": "X-ray shows joint space narrowing and osteophyte formation",
    "assessment": "Osteoarthritis of knee/hip",
    "icd10_codes": "M17.11, M16.11",
    "diagnosis_summary": "Osteoarthritis of knee/hip",
    "treatment_plan": "Medications: celecoxib 200 mg daily. Follow-up in 24 weeks.",
    "medications_prescribed": "celecoxib 200 mg daily",
    "procedures_planned": "",
    "referrals": "",
    "follow_up_weeks": 24,
    "full_clinical_note": "Emily Johnson, a 55-year-old female, presents today for chronic knee/hip pain. The patient reports joint pain and stiffness, worse in morning, improves with activity. Personal, social, and family histories have been reviewed and updated in EMR. BP 138/81 | Temp 98.3 \u00b0F | Wt 204 lb | HR 75. Physical exam reveals joint crepitus noted, mild effusion, reduced range of motion, no erythema. Labs show X-ray shows joint space narrowing and osteophyte formation. Assessment: Osteoarthritis of knee/hip (M17.11, M16.11). Plan: Prescribe celecoxib 200 mg daily. Follow up in 24 weeks.",
    "provider_name": "Dr. Smith",
    "department": "Pulmonology",
    "note_status": "FINAL",
    "created_at": "2025-03-27T01:17:14.909194",
    "updated_at": "2025-03-27T01:17:14.909194"
  },
  {
    "note_id": "NOTE00015",
    "patient_name": "Daniel Walker",
    "patient_age": 40,
    "patient_gender": "Male",
    "encounter_date": "2025-09-08T01:17:14.909204",
    "encounter_type": "Neurology Follow-up",
    "chief_complaint": "recurrent migraine headaches",
    "medical_history": "reports 3-5 headaches per month, photophobia and nausea with attacks",
    "bp_systolic": 118,
    "bp_diastolic": 70,
    "temperature_f": 98.5,
    "weight_lbs": 178,
    "heart_rate": 68,
    "vitals_text": "BP 118/70 | Temp 98.5 \u00b0F | Wt 178 lb | HR 68",
    "physical_exam": "neurological exam normal, no focal deficits",
    "lab_results": "No labs indicated, clinical diagnosis",
    "assessment": "Migraine without aura",
    "icd10_codes": "G43.009",
    "diagnosis_summary": "Migraine without aura",
    "treatment_plan": "Medications: sumatriptan 100 mg PRN. Follow-up in 16 weeks.",
    "medications_prescribed": "sumatriptan 100 mg PRN",
    "procedures_planned": "",
    "referrals": "",
    "follow_up_weeks": 16,
    "full_clinical_note": "Daniel Walker, a 40-year-old male, presents today for recurrent migraine headaches. The patient reports 3-5 headaches per month, photophobia and nausea with attacks. Personal, social, and family histories have been reviewed and updated in EMR. BP 118/70 | Temp 98.5 \u00b0F | Wt 178 lb | HR 68. Physical exam reveals neurological exam normal, no focal deficits. Assessment: Migraine without aura (G43.009). Plan: Prescribe sumatriptan 100 mg PRN. Follow up in 16 weeks.",
    "provider_name": "Dr. Jones",
    "department": "Cardiology",
    "note_status": "FINAL",
    "created_at": "2025-09-08T01:17:14.909204",
    "updated_at": "2025-09-08T01:17:14.909204"
  },
  {
    "note_id": "NOTE00016",
    "patient_name": "Susan Lewis",
    "patient_age": 23,
    "patient_gender": "Female",
    "encounter_date": "2024-01-20T01:17:14.909214",
    "encounter_type": "Neurology Follow-up",
    "chief_complaint": "recurrent migraine headaches",
    "medical_history": "reports 3-5 headaches per month, photophobia and nausea with attacks",
    "bp_systolic": 114,
    "bp_diastolic": 80,
    "temperature_f": 98.5,
    "weight_lbs": 166,
    "heart_rate": 75,
    "vitals_text": "BP 114/80 | Temp 98.5 \u00b0F | Wt 166 lb | HR 75",
    "physical_exam": "neurological exam normal, no focal deficits",
    "lab_results": "No labs indicated, clinical diagnosis",
    "assessment": "Migraine without aura",
    "icd10_codes": "G43.009",
    "diagnosis_summary": "Migraine without aura",
    "treatment_plan": "Medications: propranolol 80 mg daily, sumatriptan 100 mg PRN. Follow-up in 12 weeks.",
    "medications_prescribed": "propranolol 80 mg daily, sumatriptan 100 mg PRN",
    "procedures_planned": "",
    "referrals": "",
    "follow_up_weeks": 12,
    "full_clinical_note": "Susan Lewis, a 23-year-old female, presents today for recurrent migraine headaches. The patient reports 3-5 headaches per month, photophobia and nausea with attacks. Personal, social, and family histories have been reviewed and updated in EMR. BP 114/80 | Temp 98.5 \u00b0F | Wt 166 lb | HR 75. Physical exam reveals neurological exam normal, no focal deficits. Assessment: Migraine without aura (G43.009). Plan: Prescribe propranolol 80 mg daily, and sumatriptan 100 mg PRN. Follow up in 12 weeks.",
    "provider_name": "Dr. Johnson",
    "department": "Internal Medicine",
    "note_status": "FINAL",
    "created_at": "2024-01-20T01:17:14.909214",
    "updated_at": "2024-01-20T01:17:14.909214"
  },
  {
    "note_id": "NOTE00017",
    "patient_name": "Anthony Jackson",
    "patient_age": 43,
    "patient_gender": "Male",
    "encounter_date": "2025-09-22T01:17:14.909225",
    "encounter_type": "Mental Health Follow-up",
    "chief_complaint": "follow-up on anxiety and depression",
    "medical_history": "mentions worsening anxiety episodes triggered by work stress, denies suicidal ideation",
    "bp_systolic": 126,
    "bp_diastolic": 76,
    "temperature_f": 97.6,
    "weight_lbs": 142,
    "heart_rate": 69,
    "vitals_text": "BP 126/76 | Temp 97.6 \u00b0F | Wt 142 lb | HR 69",
    "physical_exam": "no acute distress, engages cooperatively in conversation, appropriate affect",
    "lab_results": "PHQ-9 score: 10-16 (moderate depression), GAD-7 score: 8-12 (mild-moderate anxiety)",
    "assessment": "Major depressive disorder, Generalized anxiety disorder",
    "icd10_codes": "F33.1, F41.1",
    "diagnosis_summary": "Major depressive disorder, Generalized anxiety disorder",
    "treatment_plan": "Medications: buspirone 15 mg BID, hydroxyzine 25 mg PRN anxiety, sertraline 50-150 mg daily. Follow-up in 4 weeks.",
    "medications_prescribed": "buspirone 15 mg BID, hydroxyzine 25 mg PRN anxiety, sertraline 50-150 mg daily",
    "procedures_planned": "",
    "referrals": "",
    "follow_up_weeks": 4,
    "full_clinical_note": "Anthony Jackson, a 43-year-old male, presents today for follow-up on anxiety and depression. The patient mentions worsening anxiety episodes triggered by work stress, denies suicidal ideation. Personal, social, and family histories have been reviewed and updated in EMR. BP 126/76 | Temp 97.6 \u00b0F | Wt 142 lb | HR 69. Physical exam reveals no acute distress, engages cooperatively in conversation, appropriate affect. Labs show PHQ-9 score: 10-16 (moderate depression), GAD-7 score: 8-12 (mild-moderate anxiety). Assessment: Major depressive disorder, Generalized anxiety disorder (F33.1, F41.1). Plan: Prescribe buspirone 15 mg BID, hydroxyzine 25 mg PRN anxiety, and sertraline 50-150 mg daily. Follow up in 4 weeks.",
    "provider_name": "Dr. Brown",
    "department": "Cardiology",
    "note_status": "FINAL",
    "created_at": "2025-09-22T01:17:14.909225",
    "updated_at": "2025-09-22T01:17:14.909225"
  },
  {
    "note_id": "NOTE00018",
    "patient_name": "Michelle Lee",
    "patient_age": 34,
    "patient_gender": "Female",
    "encounter_date": "2025-09-13T01:17:14.909236",
    "encounter_type": "Neurology Follow-up",
    "chief_complaint": "recurrent migraine headaches",
    "medical_history": "reports 3-5 headaches per month, photophobia and nausea with attacks",
    "bp_systolic": 118,
    "bp_diastolic": 77,
    "temperature_f": 98.0,
    "weight_lbs": 122,
    "heart_rate": 72,
    "vitals_text": "BP 118/77 | Temp 98.0 \u00b0F | Wt 122 lb | HR 72",
    "physical_exam": "neurological exam normal, no focal deficits",
    "lab_results": "No labs indicated, clinical diagnosis",
    "assessment": "Migraine without aura",
    "icd10_codes": "G43.009",
    "diagnosis_summary": "Migraine without aura",
    "treatment_plan": "Medications: propranolol 80 mg daily, sumatriptan 100 mg PRN, topiramate 50 mg BID. Follow-up in 16 weeks.",
    "medications_prescribed": "propranolol 80 mg daily, sumatriptan 100 mg PRN, topiramate 50 mg BID",
    "procedures_planned": "",
    "referrals": "",
    "follow_up_weeks": 16,
    "full_clinical_note": "Michelle Lee, a 34-year-old female, presents today for recurrent migraine headaches. The patient reports 3-5 headaches per month, photophobia and nausea with attacks. Personal, social, and family histories have been reviewed and updated in EMR. BP 118/77 | Temp 98.0 \u00b0F | Wt 122 lb | HR 72. Physical exam reveals neurological exam normal, no focal deficits. Assessment: Migraine without aura (G43.009). Plan: Prescribe propranolol 80 mg daily, sumatriptan 100 mg PRN, and topiramate 50 mg BID. Follow up in 16 weeks.",
    "provider_name": "Dr. Brown",
    "department": "Pulmonology",
    "note_status": "FINAL",
    "created_at": "2025-09-13T01:17:14.909236",
    "updated_at": "2025-09-13T01:17:14.909236"
  },
  {
    "note_id": "NOTE00019",
    "patient_name": "Joshua Martin",
    "patient_age": 70,
    "patient_gender": "Male",
    "encounter_date": "2024-11-10T01:17:14.909251",
    "encounter_type": "Annual Physical",
    "chief_complaint": "annual physical examination",
    "medical_history": "feels well, exercises regularly, balanced diet, no current complaints",
    "bp_systolic": 128,
    "bp_diastolic": 69,
    "temperature_f": 98.1,
    "weight_lbs": 166,
    "heart_rate": 64,
    "vitals_text": "BP 128/69 | Temp 98.1 \u00b0F | Wt 166 lb | HR 64",
    "physical_exam": "unremarkable, clear lungs, RRR heart sounds, normal neurological function",
    "lab_results": "CBC, CMP, lipid panel within normal limits",
    "assessment": "Health maintenance",
    "icd10_codes": "Z00.00",
    "diagnosis_summary": "Health maintenance",
    "treatment_plan": "Medications: Continue current regimen. Follow-up in 52 weeks.",
    "medications_prescribed": "Continue current regimen",
    "procedures_planned": "",
    "referrals": "",
    "follow_up_weeks": 52,
    "full_clinical_note": "Joshua Martin, a 70-year-old male, presents today for annual physical examination. The patient feels well, exercises regularly, balanced diet, no current complaints. Personal, social, and family histories have been reviewed and updated in EMR. BP 128/69 | Temp 98.1 \u00b0F | Wt 166 lb | HR 64. Physical exam reveals unremarkable, clear lungs, RRR heart sounds, normal neurological function. Labs show CBC, CMP, lipid panel within normal limits. Assessment: Health maintenance (Z00.00). Plan: Prescribe Continue current regimen. Follow up in 52 weeks.",
    "provider_name": "Dr. Jones",
    "department": "Family Medicine",
    "note_status": "FINAL",
    "created_at": "2024-11-10T01:17:14.909251",
    "updated_at": "2024-11-10T01:17:14.909251"
  },
  {
    "note_id": "NOTE00020",
    "patient_name": "Mark Lopez",
    "patient_age": 19,
    "patient_gender": "Male",
    "encounter_date": "2024-06-27T01:17:14.909262",
    "encounter_type": "Pre-operative Visit",
    "chief_complaint": "pre-surgical evaluation",
    "medical_history": "scheduled for elective surgery, no recent illnesses",
    "bp_systolic": 124,
    "bp_diastolic": 72,
    "temperature_f": 98.0,
    "weight_lbs": 183,
    "heart_rate": 84,
    "vitals_text": "BP 124/72 | Temp 98.0 \u00b0F | Wt 183 lb | HR 84",
    "physical_exam": "general health good, cardiovascular and pulmonary systems stable",
    "lab_results": "CBC, CMP, PT/INR within normal limits",
    "assessment": "Pre-operative evaluation",
    "icd10_codes": "Z01.818",
    "diagnosis_summary": "Pre-operative evaluation",
    "treatment_plan": "Medications: Continue home medications, Hold aspirin 7 days prior. Follow-up in 2 weeks.",
    "medications_prescribed": "Continue home medications, Hold aspirin 7 days prior",
    "procedures_planned": "",
    "referrals": "",
    "follow_up_weeks": 2,
    "full_clinical_note": "Mark Lopez, a 19-year-old male, presents today for pre-surgical evaluation. The patient scheduled for elective surgery, no recent illnesses. Personal, social, and family histories have been reviewed and updated in EMR. BP 124/72 | Temp 98.0 \u00b0F | Wt 183 lb | HR 84. Physical exam reveals general health good, cardiovascular and pulmonary systems stable. Labs show CBC, CMP, PT/INR within normal limits. Assessment: Pre-operative evaluation (Z01.818). Plan: Prescribe Continue home medications, and Hold aspirin 7 days prior. Follow up in 2 weeks.",
    "provider_name": "Dr. Brown",
    "department": "Family Medicine",
    "note_status": "FINAL",
    "created_at": "2024-06-27T01:17:14.909262",
    "updated_at": "2024-06-27T01:17:14.909262"
  },
  {
    "note_id": "NOTE00021",
    "patient_name": "Michael Garcia",
    "patient_age": 70,
    "patient_gender": "Male",
    "encounter_date": "2025-11-01T01:17:14.909272",
    "encounter_type": "Cardiopulmonary Follow-up",
    "chief_complaint": "routine follow-up for COPD and heart failure",
    "medical_history": "experiences dyspnea on exertion, denies chest pain, reports mild peripheral edema",
    "bp_systolic": 150,
    "bp_diastolic": 73,
    "temperature_f": 98.2,
    "weight_lbs": 193,
    "heart_rate": 88,
    "vitals_text": "BP 150/73 | Temp 98.2 \u00b0F | Wt 193 lb | HR 88",
    "physical_exam": "bilateral crackles at lung bases, S3 heart sound, mild peripheral edema (+1 to +2)",
    "lab_results": "BNP elevated at 300-450 pg/mL, creatinine stable at 1.0-1.5 mg/dL, oxygen saturation 88-92%",
    "assessment": "CHF exacerbation, COPD",
    "icd10_codes": "I50.9, J44.9",
    "diagnosis_summary": "CHF exacerbation, COPD",
    "treatment_plan": "Medications: tiotropium inhaled daily. Follow-up in 4 weeks.",
    "medications_prescribed": "tiotropium inhaled daily",
    "procedures_planned": "",
    "referrals": "",
    "follow_up_weeks": 4,
    "full_clinical_note": "Michael Garcia, a 70-year-old male, presents today for routine follow-up for COPD and heart failure. The patient experiences dyspnea on exertion, denies chest pain, reports mild peripheral edema. Personal, social, and family histories have been reviewed and updated in EMR. BP 150/73 | Temp 98.2 \u00b0F | Wt 193 lb | HR 88. Physical exam reveals bilateral crackles at lung bases, S3 heart sound, mild peripheral edema (+1 to +2). Labs show BNP elevated at 300-450 pg/mL, creatinine stable at 1.0-1.5 mg/dL, oxygen saturation 88-92%. Assessment: CHF exacerbation, COPD (I50.9, J44.9). Plan: Prescribe tiotropium inhaled daily. Follow up in 4 weeks.",
    "provider_name": "Dr. Davis",
    "department": "Cardiology",
    "note_status": "FINAL",
    "created_at": "2025-11-01T01:17:14.909272",
    "updated_at": "2025-11-01T01:17:14.909272"
  },
  {
    "note_id": "NOTE00022",
    "patient_name": "Paul Harris",
    "patient_age": 82,
    "patient_gender": "Male",
    "encounter_date": "2025-03-05T01:17:14.909283",
    "encounter_type": "Cardiopulmonary Follow-up",
    "chief_complaint": "routine follow-up for COPD and heart failure",
    "medical_history": "experiences dyspnea on exertion, denies chest pain, reports mild peripheral edema",
    "bp_systolic": 150,
    "bp_diastolic": 73,
    "temperature_f": 98.2,
    "weight_lbs": 176,
    "heart_rate": 90,
    "vitals_text": "BP 150/73 | Temp 98.2 \u00b0F | Wt 176 lb | HR 90",
    "physical_exam": "bilateral crackles at lung bases, S3 heart sound, mild peripheral edema (+1 to +2)",
    "lab_results": "BNP elevated at 300-450 pg/mL, creatinine stable at 1.0-1.5 mg/dL, oxygen saturation 88-92%",
    "assessment": "CHF exacerbation, COPD",
    "icd10_codes": "I50.9, J44.9",
    "diagnosis_summary": "CHF exacerbation, COPD",
    "treatment_plan": "Medications: tiotropium inhaled daily, carvedilol 12.5 mg BID, furosemide 40-80 mg daily. Follow-up in 6 weeks.",
    "medications_prescribed": "tiotropium inhaled daily, carvedilol 12.5 mg BID, furosemide 40-80 mg daily",
    "procedures_planned": "",
    "referrals": "",
    "follow_up_weeks": 6,
    "full_clinical_note": "Paul Harris, a 82-year-old male, presents today for routine follow-up for COPD and heart failure. The patient experiences dyspnea on exertion, denies chest pain, reports mild peripheral edema. Personal, social, and family histories have been reviewed and updated in EMR. BP 150/73 | Temp 98.2 \u00b0F | Wt 176 lb | HR 90. Physical exam reveals bilateral crackles at lung bases, S3 heart sound, mild peripheral edema (+1 to +2). Labs show BNP elevated at 300-450 pg/mL, creatinine stable at 1.0-1.5 mg/dL, oxygen saturation 88-92%. Assessment: CHF exacerbation, COPD (I50.9, J44.9). Plan: Prescribe tiotropium inhaled daily, carvedilol 12.5 mg BID, and furosemide 40-80 mg daily. Follow up in 6 weeks.",
    "provider_name": "Dr. Smith",
    "department": "Orthopedics",
    "note_status": "FINAL",
    "created_at": "2025-03-05T01:17:14.909283",
    "updated_at": "2025-03-05T01:17:14.909283"
  },
  {
    "note_id": "NOTE00023",
    "patient_name": "Richard Harris",
    "patient_age": 67,
    "patient_gender": "Male",
    "encounter_date": "2025-03-12T01:17:14.909293",
    "encounter_type": "Cardiopulmonary Follow-up",
    "chief_complaint": "routine follow-up for COPD and heart failure",
    "medical_history": "experiences dyspnea on exertion, denies chest pain, reports mild peripheral edema",
    "bp_systolic": 138,
    "bp_diastolic": 82,
    "temperature_f": 98.3,
    "weight_lbs": 186,
    "heart_rate": 100,
    "vitals_text": "BP 138/82 | Temp 98.3 \u00b0F | Wt 186 lb | HR 100",
    "physical_exam": "bilateral crackles at lung bases, S3 heart sound, mild peripheral edema (+1 to +2)",
    "lab_results": "BNP elevated at 300-450 pg/mL, creatinine stable at 1.0-1.5 mg/dL, oxygen saturation 88-92%",
    "assessment": "CHF exacerbation, COPD",
    "icd10_codes": "I50.9, J44.9",
    "diagnosis_summary": "CHF exacerbation, COPD",
    "treatment_plan": "Medications: furosemide 40-80 mg daily, carvedilol 12.5 mg BID. Follow-up in 6 weeks.",
    "medications_prescribed": "furosemide 40-80 mg daily, carvedilol 12.5 mg BID",
    "procedures_planned": "",
    "referrals": "",
    "follow_up_weeks": 6,
    "full_clinical_note": "Richard Harris, a 67-year-old male, presents today for routine follow-up for COPD and heart failure. The patient experiences dyspnea on exertion, denies chest pain, reports mild peripheral edema. Personal, social, and family histories have been reviewed and updated in EMR. BP 138/82 | Temp 98.3 \u00b0F | Wt 186 lb | HR 100. Physical exam reveals bilateral crackles at lung bases, S3 heart sound, mild peripheral edema (+1 to +2). Labs show BNP elevated at 300-450 pg/mL, creatinine stable at 1.0-1.5 mg/dL, oxygen saturation 88-92%. Assessment: CHF exacerbation, COPD (I50.9, J44.9). Plan: Prescribe furosemide 40-80 mg daily, and carvedilol 12.5 mg BID. Follow up in 6 weeks.",
    "provider_name": "Dr. Brown",
    "department": "Pulmonology",
    "note_status": "FINAL",
    "created_at": "2025-03-12T01:17:14.909293",
    "updated_at": "2025-03-12T01:17:14.909293"
  },
  {
    "note_id": "NOTE00024",
    "patient_name": "Mary Wilson",
    "patient_age": 80,
    "patient_gender": "Female",
    "encounter_date": "2025-11-04T01:17:14.909306",
    "encounter_type": "Orthopedic Follow-up",
    "chief_complaint": "chronic knee/hip pain",
    "medical_history": "reports joint pain and stiffness, worse in morning, improves with activity",
    "bp_systolic": 138,
    "bp_diastolic": 86,
    "temperature_f": 98.0,
    "weight_lbs": 197,
    "heart_rate": 70,
    "vitals_text": "BP 138/86 | Temp 98.0 \u00b0F | Wt 197 lb | HR 70",
    "physical_exam": "joint crepitus noted, mild effusion, reduced range of motion, no erythema",
    "lab_results": "X-ray shows joint space narrowing and osteophyte formation",
    "assessment": "Osteoarthritis of knee/hip",
    "icd10_codes": "M17.11, M16.11",
    "diagnosis_summary": "Osteoarthritis of knee/hip",
    "treatment_plan": "Medications: acetaminophen 1000 mg TID, celecoxib 200 mg daily. Follow-up in 16 weeks.",
    "medications_prescribed": "acetaminophen 1000 mg TID, celecoxib 200 mg daily",
    "procedures_planned": "",
    "referrals": "",
    "follow_up_weeks": 16,
    "full_clinical_note": "Mary Wilson, a 80-year-old female, presents today for chronic knee/hip pain. The patient reports joint pain and stiffness, worse in morning, improves with activity. Personal, social, and family histories have been reviewed and updated in EMR. BP 138/86 | Temp 98.0 \u00b0F | Wt 197 lb | HR 70. Physical exam reveals joint crepitus noted, mild effusion, reduced range of motion, no erythema. Labs show X-ray shows joint space narrowing and osteophyte formation. Assessment: Osteoarthritis of knee/hip (M17.11, M16.11). Plan: Prescribe acetaminophen 1000 mg TID, and celecoxib 200 mg daily. Follow up in 16 weeks.",
    "provider_name": "Dr. Smith",
    "department": "Family Medicine",
    "note_status": "FINAL",
    "created_at": "2025-11-04T01:17:14.909306",
    "updated_at": "2025-11-04T01:17:14.909306"
  },
  {
    "note_id": "NOTE00025",
    "patient_name": "William Anderson",
    "patient_age": 51,
    "patient_gender": "Male",
    "encounter_date": "2025-05-26T01:17:14.909317",
    "encounter_type": "Follow-up Visit",
    "chief_complaint": "follow-up of chronic conditions",
    "medical_history": "reports compliance with medications but notes occasional headaches",
    "bp_systolic": 137,
    "bp_diastolic": 94,
    "temperature_f": 98.3,
    "weight_lbs": 185,
    "heart_rate": 84,
    "vitals_text": "BP 137/94 | Temp 98.3 \u00b0F | Wt 185 lb | HR 84",
    "physical_exam": "no acute distress, heart RRR with no murmurs, lungs clear bilaterally",
    "lab_results": "fasting glucose: 145-165 mg/dL, HbA1c: 7.5-9.0%, LDL 110-140 mg/dL, HDL 35-45 mg/dL",
    "assessment": "Essential hypertension, Type 2 diabetes",
    "icd10_codes": "I10, E11.65",
    "diagnosis_summary": "Essential hypertension, Type 2 diabetes",
    "treatment_plan": "Medications: lisinopril 10-20 mg daily, atorvastatin 20 mg daily, metformin 1000 mg BID. Follow-up in 12 weeks.",
    "medications_prescribed": "lisinopril 10-20 mg daily, atorvastatin 20 mg daily, metformin 1000 mg BID",
    "procedures_planned": "",
    "referrals": "",
    "follow_up_weeks": 12,
    "full_clinical_note": "William Anderson, a 51-year-old male, presents today for follow-up of chronic conditions. The patient reports compliance with medications but notes occasional headaches. Personal, social, and family histories have been reviewed and updated in EMR. BP 137/94 | Temp 98.3 \u00b0F | Wt 185 lb | HR 84. Physical exam reveals no acute distress, heart RRR with no murmurs, lungs clear bilaterally. Labs show fasting glucose: 145-165 mg/dL, HbA1c: 7.5-9.0%, LDL 110-140 mg/dL, HDL 35-45 mg/dL. Assessment: Essential hypertension, Type 2 diabetes (I10, E11.65). Plan: Prescribe lisinopril 10-20 mg daily, atorvastatin 20 mg daily, and metformin 1000 mg BID. Follow up in 12 weeks.",
    "provider_name": "Dr. Williams",
    "department": "Internal Medicine",
    "note_status": "FINAL",
    "created_at": "2025-05-26T01:17:14.909317",
    "updated_at": "2025-05-26T01:17:14.909317"
  },
  {
    "note_id": "NOTE00026",
    "patient_name": "Robert Jones",
    "patient_age": 37,
    "patient_gender": "Male",
    "encounter_date": "2024-08-03T01:17:14.909328",
    "encounter_type": "Pain Management",
    "chief_complaint": "evaluation of chronic back pain",
    "medical_history": "reports pain intensity 5-7/10, exacerbated with prolonged sitting, occasional radiation to leg",
    "bp_systolic": 127,
    "bp_diastolic": 90,
    "temperature_f": 98.5,
    "weight_lbs": 268,
    "heart_rate": 79,
    "vitals_text": "BP 127/90 | Temp 98.5 \u00b0F | Wt 268 lb | HR 79",
    "physical_exam": "neurologically intact, tenderness over lumbar spine, mild restriction in forward flexion",
    "lab_results": "MRI lumbar spine shows L4-L5 or L5-S1 degenerative disc changes",
    "assessment": "Chronic low back pain, lumbar spondylosis",
    "icd10_codes": "M54.5, M47.816",
    "diagnosis_summary": "Chronic low back pain, lumbar spondylosis",
    "treatment_plan": "Medications: meloxicam 15 mg daily, gabapentin 300-600 mg TID. Follow-up in 12 weeks.",
    "medications_prescribed": "meloxicam 15 mg daily, gabapentin 300-600 mg TID",
    "procedures_planned": "",
    "referrals": "",
    "follow_up_weeks": 12,
    "full_clinical_note": "Robert Jones, a 37-year-old male, presents today for evaluation of chronic back pain. The patient reports pain intensity 5-7/10, exacerbated with prolonged sitting, occasional radiation to leg. Personal, social, and family histories have been reviewed and updated in EMR. BP 127/90 | Temp 98.5 \u00b0F | Wt 268 lb | HR 79. Physical exam reveals neurologically intact, tenderness over lumbar spine, mild restriction in forward flexion. Labs show MRI lumbar spine shows L4-L5 or L5-S1 degenerative disc changes. Assessment: Chronic low back pain, lumbar spondylosis (M54.5, M47.816). Plan: Prescribe meloxicam 15 mg daily, and gabapentin 300-600 mg TID. Follow up in 12 weeks.",
    "provider_name": "Dr. Smith",
    "department": "Orthopedics",
    "note_status": "FINAL",
    "created_at": "2024-08-03T01:17:14.909328",
    "updated_at": "2024-08-03T01:17:14.909328"
  },
  {
    "note_id": "NOTE00027",
    "patient_name": "Paul Clark",
    "patient_age": 46,
    "patient_gender": "Male",
    "encounter_date": "2024-10-23T01:17:14.909339",
    "encounter_type": "Mental Health Follow-up",
    "chief_complaint": "follow-up on anxiety and depression",
    "medical_history": "mentions worsening anxiety episodes triggered by work stress, denies suicidal ideation",
    "bp_systolic": 110,
    "bp_diastolic": 74,
    "temperature_f": 98.4,
    "weight_lbs": 156,
    "heart_rate": 67,
    "vitals_text": "BP 110/74 | Temp 98.4 \u00b0F | Wt 156 lb | HR 67",
    "physical_exam": "no acute distress, engages cooperatively in conversation, appropriate affect",
    "lab_results": "PHQ-9 score: 10-16 (moderate depression), GAD-7 score: 8-12 (mild-moderate anxiety)",
    "assessment": "Major depressive disorder, Generalized anxiety disorder",
    "icd10_codes": "F33.1, F41.1",
    "diagnosis_summary": "Major depressive disorder, Generalized anxiety disorder",
    "treatment_plan": "Medications: buspirone 15 mg BID, hydroxyzine 25 mg PRN anxiety, sertraline 50-150 mg daily. Follow-up in 6 weeks.",
    "medications_prescribed": "buspirone 15 mg BID, hydroxyzine 25 mg PRN anxiety, sertraline 50-150 mg daily",
    "procedures_planned": "",
    "referrals": "",
    "follow_up_weeks": 6,
    "full_clinical_note": "Paul Clark, a 46-year-old male, presents today for follow-up on anxiety and depression. The patient mentions worsening anxiety episodes triggered by work stress, denies suicidal ideation. Personal, social, and family histories have been reviewed and updated in EMR. BP 110/74 | Temp 98.4 \u00b0F | Wt 156 lb | HR 67. Physical exam reveals no acute distress, engages cooperatively in conversation, appropriate affect. Labs show PHQ-9 score: 10-16 (moderate depression), GAD-7 score: 8-12 (mild-moderate anxiety). Assessment: Major depressive disorder, Generalized anxiety disorder (F33.1, F41.1). Plan: Prescribe buspirone 15 mg BID, hydroxyzine 25 mg PRN anxiety, and sertraline 50-150 mg daily. Follow up in 6 weeks.",
    "provider_name": "Dr. Brown",
    "department": "Orthopedics",
    "note_status": "FINAL",
    "created_at": "2024-10-23T01:17:14.909339",
    "updated_at": "2024-10-23T01:17:14.909339"
  },
  {
    "note_id": "NOTE00028",
    "patient_name": "Paul Moore",
    "patient_age": 62,
    "patient_gender": "Male",
    "encounter_date": "2024-02-29T01:17:14.909350",
    "encounter_type": "Orthopedic Follow-up",
    "chief_complaint": "chronic knee/hip pain",
    "medical_history": "reports joint pain and stiffness, worse in morning, improves with activity",
    "bp_systolic": 138,
    "bp_diastolic": 87,
    "temperature_f": 97.5,
    "weight_lbs": 170,
    "heart_rate": 78,
    "vitals_text": "BP 138/87 | Temp 97.5 \u00b0F | Wt 170 lb | HR 78",
    "physical_exam": "joint crepitus noted, mild effusion, reduced range of motion, no erythema",
    "lab_results": "X-ray shows joint space narrowing and osteophyte formation",
    "assessment": "Osteoarthritis of knee/hip",
    "icd10_codes": "M17.11, M16.11",
    "diagnosis_summary": "Osteoarthritis of knee/hip",
    "treatment_plan": "Medications: acetaminophen 1000 mg TID, glucosamine 1500 mg daily, celecoxib 200 mg daily. Follow-up in 12 weeks.",
    "medications_prescribed": "acetaminophen 1000 mg TID, glucosamine 1500 mg daily, celecoxib 200 mg daily",
    "procedures_planned": "",
    "referrals": "",
    "follow_up_weeks": 12,
    "full_clinical_note": "Paul Moore, a 62-year-old male, presents today for chronic knee/hip pain. The patient reports joint pain and stiffness, worse in morning, improves with activity. Personal, social, and family histories have been reviewed and updated in EMR. BP 138/87 | Temp 97.5 \u00b0F | Wt 170 lb | HR 78. Physical exam reveals joint crepitus noted, mild effusion, reduced range of motion, no erythema. Labs show X-ray shows joint space narrowing and osteophyte formation. Assessment: Osteoarthritis of knee/hip (M17.11, M16.11). Plan: Prescribe acetaminophen 1000 mg TID, glucosamine 1500 mg daily, and celecoxib 200 mg daily. Follow up in 12 weeks.",
    "provider_name": "Dr. Williams",
    "department": "Family Medicine",
    "note_status": "FINAL",
    "created_at": "2024-02-29T01:17:14.909350",
    "updated_at": "2024-02-29T01:17:14.909350"
  },
  {
    "note_id": "NOTE00029",
    "patient_name": "Kimberly Martinez",
    "patient_age": 10,
    "patient_gender": "Female",
    "encounter_date": "2024-06-20T01:17:14.909360",
    "encounter_type": "Pre-operative Visit",
    "chief_complaint": "pre-surgical evaluation",
    "medical_history": "scheduled for elective surgery, no recent illnesses",
    "bp_systolic": 125,
    "bp_diastolic": 81,
    "temperature_f": 98.5,
    "weight_lbs": 108,
    "heart_rate": 89,
    "vitals_text": "BP 125/81 | Temp 98.5 \u00b0F | Wt 108 lb | HR 89",
    "physical_exam": "general health good, cardiovascular and pulmonary systems stable",
    "lab_results": "CBC, CMP, PT/INR within normal limits",
    "assessment": "Pre-operative evaluation",
    "icd10_codes": "Z01.818",
    "diagnosis_summary": "Pre-operative evaluation",
    "treatment_plan": "Medications: Hold aspirin 7 days prior, Continue home medications. Follow-up in 1 weeks.",
    "medications_prescribed": "Hold aspirin 7 days prior, Continue home medications",
    "procedures_planned": "",
    "referrals": "",
    "follow_up_weeks": 1,
    "full_clinical_note": "Kimberly Martinez, a 10-year-old female, presents today for pre-surgical evaluation. The patient scheduled for elective surgery, no recent illnesses. Personal, social, and family histories have been reviewed and updated in EMR. BP 125/81 | Temp 98.5 \u00b0F | Wt 108 lb | HR 89. Physical exam reveals general health good, cardiovascular and pulmonary systems stable. Labs show CBC, CMP, PT/INR within normal limits. Assessment: Pre-operative evaluation (Z01.818). Plan: Prescribe Hold aspirin 7 days prior, and Continue home medications. Follow up in 1 weeks.",
    "provider_name": "Dr. Brown",
    "department": "Cardiology",
    "note_status": "FINAL",
    "created_at": "2024-06-20T01:17:14.909360",
    "updated_at": "2024-06-20T01:17:14.909360"
  },
  {
    "note_id": "NOTE00030",
    "patient_name": "Lisa Brown",
    "patient_age": 80,
    "patient_gender": "Female",
    "encounter_date": "2024-12-15T01:17:14.909370",
    "encounter_type": "Cardiopulmonary Follow-up",
    "chief_complaint": "routine follow-up for COPD and heart failure",
    "medical_history": "experiences dyspnea on exertion, denies chest pain, reports mild peripheral edema",
    "bp_systolic": 131,
    "bp_diastolic": 80,
    "temperature_f": 98.0,
    "weight_lbs": 164,
    "heart_rate": 81,
    "vitals_text": "BP 131/80 | Temp 98.0 \u00b0F | Wt 164 lb | HR 81",
    "physical_exam": "bilateral crackles at lung bases, S3 heart sound, mild peripheral edema (+1 to +2)",
    "lab_results": "BNP elevated at 300-450 pg/mL, creatinine stable at 1.0-1.5 mg/dL, oxygen saturation 88-92%",
    "assessment": "CHF exacerbation, COPD",
    "icd10_codes": "I50.9, J44.9",
    "diagnosis_summary": "CHF exacerbation, COPD",
    "treatment_plan": "Medications: furosemide 40-80 mg daily, carvedilol 12.5 mg BID. Follow-up in 2 weeks.",
    "medications_prescribed": "furosemide 40-80 mg daily, carvedilol 12.5 mg BID",
    "procedures_planned": "",
    "referrals": "",
    "follow_up_weeks": 2,
    "full_clinical_note": "Lisa Brown, a 80-year-old female, presents today for routine follow-up for COPD and heart failure. The patient experiences dyspnea on exertion, denies chest pain, reports mild peripheral edema. Personal, social, and family histories have been reviewed and updated in EMR. BP 131/80 | Temp 98.0 \u00b0F | Wt 164 lb | HR 81. Physical exam reveals bilateral crackles at lung bases, S3 heart sound, mild peripheral edema (+1 to +2). Labs show BNP elevated at 300-450 pg/mL, creatinine stable at 1.0-1.5 mg/dL, oxygen saturation 88-92%. Assessment: CHF exacerbation, COPD (I50.9, J44.9). Plan: Prescribe furosemide 40-80 mg daily, and carvedilol 12.5 mg BID. Follow up in 2 weeks.",
    "provider_name": "Dr. Davis",
    "department": "Cardiology",
    "note_status": "FINAL",
    "created_at": "2024-12-15T01:17:14.909370",
    "updated_at": "2024-12-15T01:17:14.909370"
  },
  {
    "note_id": "NOTE00031",
    "patient_name": "Jessica Gonzalez",
    "patient_age": 46,
    "patient_gender": "Female",
    "encounter_date": "2025-09-10T01:17:14.909380",
    "encounter_type": "Pain Management",
    "chief_complaint": "evaluation of chronic back pain",
    "medical_history": "reports pain intensity 5-7/10, exacerbated with prolonged sitting, occasional radiation to leg",
    "bp_systolic": 142,
    "bp_diastolic": 82,
    "temperature_f": 98.0,
    "weight_lbs": 245,
    "heart_rate": 82,
    "vitals_text": "BP 142/82 | Temp 98.0 \u00b0F | Wt 245 lb | HR 82",
    "physical_exam": "neurologically intact, tenderness over lumbar spine, mild restriction in forward flexion",
    "lab_results": "MRI lumbar spine shows L4-L5 or L5-S1 degenerative disc changes",
    "assessment": "Chronic low back pain, lumbar spondylosis",
    "icd10_codes": "M54.5, M47.816",
    "diagnosis_summary": "Chronic low back pain, lumbar spondylosis",
    "treatment_plan": "Medications: meloxicam 15 mg daily. Follow-up in 8 weeks.",
    "medications_prescribed": "meloxicam 15 mg daily",
    "procedures_planned": "",
    "referrals": "",
    "follow_up_weeks": 8,
    "full_clinical_note": "Jessica Gonzalez, a 46-year-old female, presents today for evaluation of chronic back pain. The patient reports pain intensity 5-7/10, exacerbated with prolonged sitting, occasional radiation to leg. Personal, social, and family histories have been reviewed and updated in EMR. BP 142/82 | Temp 98.0 \u00b0F | Wt 245 lb | HR 82. Physical exam reveals neurologically intact, tenderness over lumbar spine, mild restriction in forward flexion. Labs show MRI lumbar spine shows L4-L5 or L5-S1 degenerative disc changes. Assessment: Chronic low back pain, lumbar spondylosis (M54.5, M47.816). Plan: Prescribe meloxicam 15 mg daily. Follow up in 8 weeks.",
    "provider_name": "Dr. Williams",
    "department": "Family Medicine",
    "note_status": "FINAL",
    "created_at": "2025-09-10T01:17:14.909380",
    "updated_at": "2025-09-10T01:17:14.909380"
  },
  {
    "note_id": "NOTE00032",
    "patient_name": "Karen White",
    "patient_age": 35,
    "patient_gender": "Female",
    "encounter_date": "2024-11-10T01:17:14.909390",
    "encounter_type": "Endocrine Follow-up",
    "chief_complaint": "thyroid disorder follow-up",
    "medical_history": "reports fatigue and weight gain, compliant with thyroid medication",
    "bp_systolic": 116,
    "bp_diastolic": 84,
    "temperature_f": 97.3,
    "weight_lbs": 151,
    "heart_rate": 61,
    "vitals_text": "BP 116/84 | Temp 97.3 \u00b0F | Wt 151 lb | HR 61",
    "physical_exam": "thyroid non-palpable, no nodules, normal cardiovascular exam",
    "lab_results": "TSH: 5.5-8.5 mIU/L, Free T4: 0.7-0.9 ng/dL",
    "assessment": "Hypothyroidism",
    "icd10_codes": "E03.9",
    "diagnosis_summary": "Hypothyroidism",
    "treatment_plan": "Medications: levothyroxine 75-125 mcg daily. Follow-up in 24 weeks.",
    "medications_prescribed": "levothyroxine 75-125 mcg daily",
    "procedures_planned": "",
    "referrals": "",
    "follow_up_weeks": 24,
    "full_clinical_note": "Karen White, a 35-year-old female, presents today for thyroid disorder follow-up. The patient reports fatigue and weight gain, compliant with thyroid medication. Personal, social, and family histories have been reviewed and updated in EMR. BP 116/84 | Temp 97.3 \u00b0F | Wt 151 lb | HR 61. Physical exam reveals thyroid non-palpable, no nodules, normal cardiovascular exam. Labs show TSH: 5.5-8.5 mIU/L, Free T4: 0.7-0.9 ng/dL. Assessment: Hypothyroidism (E03.9). Plan: Prescribe levothyroxine 75-125 mcg daily. Follow up in 24 weeks.",
    "provider_name": "Dr. Brown",
    "department": "Family Medicine",
    "note_status": "FINAL",
    "created_at": "2024-11-10T01:17:14.909390",
    "updated_at": "2024-11-10T01:17:14.909390"
  },
  {
    "note_id": "NOTE00033",
    "patient_name": "Barbara Martinez",
    "patient_age": 38,
    "patient_gender": "Female",
    "encounter_date": "2024-04-19T01:17:14.909400",
    "encounter_type": "Annual Physical",
    "chief_complaint": "annual physical examination",
    "medical_history": "feels well, exercises regularly, balanced diet, no current complaints",
    "bp_systolic": 118,
    "bp_diastolic": 75,
    "temperature_f": 97.9,
    "weight_lbs": 167,
    "heart_rate": 73,
    "vitals_text": "BP 118/75 | Temp 97.9 \u00b0F | Wt 167 lb | HR 73",
    "physical_exam": "unremarkable, clear lungs, RRR heart sounds, normal neurological function",
    "lab_results": "CBC, CMP, lipid panel within normal limits",
    "assessment": "Health maintenance",
    "icd10_codes": "Z00.00",
    "diagnosis_summary": "Health maintenance",
    "treatment_plan": "Medications: Continue current regimen. Follow-up in 52 weeks.",
    "medications_prescribed": "Continue current regimen",
    "procedures_planned": "",
    "referrals": "",
    "follow_up_weeks": 52,
    "full_clinical_note": "Barbara Martinez, a 38-year-old female, presents today for annual physical examination. The patient feels well, exercises regularly, balanced diet, no current complaints. Personal, social, and family histories have been reviewed and updated in EMR. BP 118/75 | Temp 97.9 \u00b0F | Wt 167 lb | HR 73. Physical exam reveals unremarkable, clear lungs, RRR heart sounds, normal neurological function. Labs show CBC, CMP, lipid panel within normal limits. Assessment: Health maintenance (Z00.00). Plan: Prescribe Continue current regimen. Follow up in 52 weeks.",
    "provider_name": "Dr. Williams",
    "department": "Pulmonology",
    "note_status": "FINAL",
    "created_at": "2024-04-19T01:17:14.909400",
    "updated_at": "2024-04-19T01:17:14.909400"
  },
  {
    "note_id": "NOTE00034",
    "patient_name": "Lisa Robinson",
    "patient_age": 68,
    "patient_gender": "Female",
    "encounter_date": "2025-06-06T01:17:14.909409",
    "encounter_type": "Annual Physical",
    "chief_complaint": "annual physical examination",
    "medical_history": "feels well, exercises regularly, balanced diet, no current complaints",
    "bp_systolic": 128,
    "bp_diastolic": 77,
    "temperature_f": 98.4,
    "weight_lbs": 157,
    "heart_rate": 80,
    "vitals_text": "BP 128/77 | Temp 98.4 \u00b0F | Wt 157 lb | HR 80",
    "physical_exam": "unremarkable, clear lungs, RRR heart sounds, normal neurological function",
    "lab_results": "CBC, CMP, lipid panel within normal limits",
    "assessment": "Health maintenance",
    "icd10_codes": "Z00.00",
    "diagnosis_summary": "Health maintenance",
    "treatment_plan": "Medications: Continue current regimen. Follow-up in 52 weeks.",
    "medications_prescribed": "Continue current regimen",
    "procedures_planned": "",
    "referrals": "",
    "follow_up_weeks": 52,
    "full_clinical_note": "Lisa Robinson, a 68-year-old female, presents today for annual physical examination. The patient feels well, exercises regularly, balanced diet, no current complaints. Personal, social, and family histories have been reviewed and updated in EMR. BP 128/77 | Temp 98.4 \u00b0F | Wt 157 lb | HR 80. Physical exam reveals unremarkable, clear lungs, RRR heart sounds, normal neurological function. Labs show CBC, CMP, lipid panel within normal limits. Assessment: Health maintenance (Z00.00). Plan: Prescribe Continue current regimen. Follow up in 52 weeks.",
    "provider_name": "Dr. Jones",
    "department": "Family Medicine",
    "note_status": "FINAL",
    "created_at": "2025-06-06T01:17:14.909409",
    "updated_at": "2025-06-06T01:17:14.909409"
  },
  {
    "note_id": "NOTE00035",
    "patient_name": "Betty Taylor",
    "patient_age": 77,
    "patient_gender": "Female",
    "encounter_date": "2024-01-15T01:17:14.909418",
    "encounter_type": "Orthopedic Follow-up",
    "chief_complaint": "chronic knee/hip pain",
    "medical_history": "reports joint pain and stiffness, worse in morning, improves with activity",
    "bp_systolic": 139,
    "bp_diastolic": 75,
    "temperature_f": 97.6,
    "weight_lbs": 187,
    "heart_rate": 72,
    "vitals_text": "BP 139/75 | Temp 97.6 \u00b0F | Wt 187 lb | HR 72",
    "physical_exam": "joint crepitus noted, mild effusion, reduced range of motion, no erythema",
    "lab_results": "X-ray shows joint space narrowing and osteophyte formation",
    "assessment": "Osteoarthritis of knee/hip",
    "icd10_codes": "M17.11, M16.11",
    "diagnosis_summary": "Osteoarthritis of knee/hip",
    "treatment_plan": "Medications: acetaminophen 1000 mg TID, celecoxib 200 mg daily. Follow-up in 16 weeks.",
    "medications_prescribed": "acetaminophen 1000 mg TID, celecoxib 200 mg daily",
    "procedures_planned": "",
    "referrals": "",
    "follow_up_weeks": 16,
    "full_clinical_note": "Betty Taylor, a 77-year-old female, presents today for chronic knee/hip pain. The patient reports joint pain and stiffness, worse in morning, improves with activity. Personal, social, and family histories have been reviewed and updated in EMR. BP 139/75 | Temp 97.6 \u00b0F | Wt 187 lb | HR 72. Physical exam reveals joint crepitus noted, mild effusion, reduced range of motion, no erythema. Labs show X-ray shows joint space narrowing and osteophyte formation. Assessment: Osteoarthritis of knee/hip (M17.11, M16.11). Plan: Prescribe acetaminophen 1000 mg TID, and celecoxib 200 mg daily. Follow up in 16 weeks.",
    "provider_name": "Dr. Smith",
    "department": "Family Medicine",
    "note_status": "FINAL",
    "created_at": "2024-01-15T01:17:14.909418",
    "updated_at": "2024-01-15T01:17:14.909418"
  },
  {
    "note_id": "NOTE00036",
    "patient_name": "Emily Walker",
    "patient_age": 78,
    "patient_gender": "Female",
    "encounter_date": "2024-03-20T01:17:14.909428",
    "encounter_type": "Orthopedic Follow-up",
    "chief_complaint": "chronic knee/hip pain",
    "medical_history": "reports joint pain and stiffness, worse in morning, improves with activity",
    "bp_systolic": 136,
    "bp_diastolic": 79,
    "temperature_f": 98.2,
    "weight_lbs": 216,
    "heart_rate": 69,
    "vitals_text": "BP 136/79 | Temp 98.2 \u00b0F | Wt 216 lb | HR 69",
    "physical_exam": "joint crepitus noted, mild effusion, reduced range of motion, no erythema",
    "lab_results": "X-ray shows joint space narrowing and osteophyte formation",
    "assessment": "Osteoarthritis of knee/hip",
    "icd10_codes": "M17.11, M16.11",
    "diagnosis_summary": "Osteoarthritis of knee/hip",
    "treatment_plan": "Medications: glucosamine 1500 mg daily, celecoxib 200 mg daily, acetaminophen 1000 mg TID. Follow-up in 24 weeks.",
    "medications_prescribed": "glucosamine 1500 mg daily, celecoxib 200 mg daily, acetaminophen 1000 mg TID",
    "procedures_planned": "",
    "referrals": "",
    "follow_up_weeks": 24,
    "full_clinical_note": "Emily Walker, a 78-year-old female, presents today for chronic knee/hip pain. The patient reports joint pain and stiffness, worse in morning, improves with activity. Personal, social, and family histories have been reviewed and updated in EMR. BP 136/79 | Temp 98.2 \u00b0F | Wt 216 lb | HR 69. Physical exam reveals joint crepitus noted, mild effusion, reduced range of motion, no erythema. Labs show X-ray shows joint space narrowing and osteophyte formation. Assessment: Osteoarthritis of knee/hip (M17.11, M16.11). Plan: Prescribe glucosamine 1500 mg daily, celecoxib 200 mg daily, and acetaminophen 1000 mg TID. Follow up in 24 weeks.",
    "provider_name": "Dr. Brown",
    "department": "Family Medicine",
    "note_status": "FINAL",
    "created_at": "2024-03-20T01:17:14.909428",
    "updated_at": "2024-03-20T01:17:14.909428"
  },
  {
    "note_id": "NOTE00037",
    "patient_name": "Joseph Thompson",
    "patient_age": 64,
    "patient_gender": "Male",
    "encounter_date": "2024-01-07T01:17:14.909445",
    "encounter_type": "Pre-operative Visit",
    "chief_complaint": "pre-surgical evaluation",
    "medical_history": "scheduled for elective surgery, no recent illnesses",
    "bp_systolic": 137,
    "bp_diastolic": 80,
    "temperature_f": 98.4,
    "weight_lbs": 121,
    "heart_rate": 76,
    "vitals_text": "BP 137/80 | Temp 98.4 \u00b0F | Wt 121 lb | HR 76",
    "physical_exam": "general health good, cardiovascular and pulmonary systems stable",
    "lab_results": "CBC, CMP, PT/INR within normal limits",
    "assessment": "Pre-operative evaluation",
    "icd10_codes": "Z01.818",
    "diagnosis_summary": "Pre-operative evaluation",
    "treatment_plan": "Medications: Continue home medications, Hold aspirin 7 days prior. Follow-up in 1 weeks.",
    "medications_prescribed": "Continue home medications, Hold aspirin 7 days prior",
    "procedures_planned": "",
    "referrals": "",
    "follow_up_weeks": 1,
    "full_clinical_note": "Joseph Thompson, a 64-year-old male, presents today for pre-surgical evaluation. The patient scheduled for elective surgery, no recent illnesses. Personal, social, and family histories have been reviewed and updated in EMR. BP 137/80 | Temp 98.4 \u00b0F | Wt 121 lb | HR 76. Physical exam reveals general health good, cardiovascular and pulmonary systems stable. Labs show CBC, CMP, PT/INR within normal limits. Assessment: Pre-operative evaluation (Z01.818). Plan: Prescribe Continue home medications, and Hold aspirin 7 days prior. Follow up in 1 weeks.",
    "provider_name": "Dr. Williams",
    "department": "Cardiology",
    "note_status": "FINAL",
    "created_at": "2024-01-07T01:17:14.909445",
    "updated_at": "2024-01-07T01:17:14.909445"
  },
  {
    "note_id": "NOTE00038",
    "patient_name": "Joshua Taylor",
    "patient_age": 56,
    "patient_gender": "Male",
    "encounter_date": "2024-01-19T01:17:14.909456",
    "encounter_type": "Endocrine Follow-up",
    "chief_complaint": "thyroid disorder follow-up",
    "medical_history": "reports fatigue and weight gain, compliant with thyroid medication",
    "bp_systolic": 118,
    "bp_diastolic": 70,
    "temperature_f": 97.2,
    "weight_lbs": 146,
    "heart_rate": 64,
    "vitals_text": "BP 118/70 | Temp 97.2 \u00b0F | Wt 146 lb | HR 64",
    "physical_exam": "thyroid non-palpable, no nodules, normal cardiovascular exam",
    "lab_results": "TSH: 5.5-8.5 mIU/L, Free T4: 0.7-0.9 ng/dL",
    "assessment": "Hypothyroidism",
    "icd10_codes": "E03.9",
    "diagnosis_summary": "Hypothyroidism",
    "treatment_plan": "Medications: levothyroxine 75-125 mcg daily. Follow-up in 12 weeks.",
    "medications_prescribed": "levothyroxine 75-125 mcg daily",
    "procedures_planned": "",
    "referrals": "",
    "follow_up_weeks": 12,
    "full_clinical_note": "Joshua Taylor, a 56-year-old male, presents today for thyroid disorder follow-up. The patient reports fatigue and weight gain, compliant with thyroid medication. Personal, social, and family histories have been reviewed and updated in EMR. BP 118/70 | Temp 97.2 \u00b0F | Wt 146 lb | HR 64. Physical exam reveals thyroid non-palpable, no nodules, normal cardiovascular exam. Labs show TSH: 5.5-8.5 mIU/L, Free T4: 0.7-0.9 ng/dL. Assessment: Hypothyroidism (E03.9). Plan: Prescribe levothyroxine 75-125 mcg daily. Follow up in 12 weeks.",
    "provider_name": "Dr. Smith",
    "department": "Cardiology",
    "note_status": "FINAL",
    "created_at": "2024-01-19T01:17:14.909456",
    "updated_at": "2024-01-19T01:17:14.909456"
  },
  {
    "note_id": "NOTE00039",
    "patient_name": "Michael Sanchez",
    "patient_age": 32,
    "patient_gender": "Male",
    "encounter_date": "2025-05-08T01:17:14.909467",
    "encounter_type": "Pre-operative Visit",
    "chief_complaint": "pre-surgical evaluation",
    "medical_history": "scheduled for elective surgery, no recent illnesses",
    "bp_systolic": 120,
    "bp_diastolic": 79,
    "temperature_f": 97.5,
    "weight_lbs": 188,
    "heart_rate": 71,
    "vitals_text": "BP 120/79 | Temp 97.5 \u00b0F | Wt 188 lb | HR 71",
    "physical_exam": "general health good, cardiovascular and pulmonary systems stable",
    "lab_results": "CBC, CMP, PT/INR within normal limits",
    "assessment": "Pre-operative evaluation",
    "icd10_codes": "Z01.818",
    "diagnosis_summary": "Pre-operative evaluation",
    "treatment_plan": "Medications: Continue home medications. Follow-up in 1 weeks.",
    "medications_prescribed": "Continue home medications",
    "procedures_planned": "",
    "referrals": "",
    "follow_up_weeks": 1,
    "full_clinical_note": "Michael Sanchez, a 32-year-old male, presents today for pre-surgical evaluation. The patient scheduled for elective surgery, no recent illnesses. Personal, social, and family histories have been reviewed and updated in EMR. BP 120/79 | Temp 97.5 \u00b0F | Wt 188 lb | HR 71. Physical exam reveals general health good, cardiovascular and pulmonary systems stable. Labs show CBC, CMP, PT/INR within normal limits. Assessment: Pre-operative evaluation (Z01.818). Plan: Prescribe Continue home medications. Follow up in 1 weeks.",
    "provider_name": "Dr. Williams",
    "department": "Family Medicine",
    "note_status": "FINAL",
    "created_at": "2025-05-08T01:17:14.909467",
    "updated_at": "2025-05-08T01:17:14.909467"
  },
  {
    "note_id": "NOTE00040",
    "patient_name": "Ashley Sanchez",
    "patient_age": 68,
    "patient_gender": "Female",
    "encounter_date": "2025-06-09T01:17:14.909476",
    "encounter_type": "Follow-up Visit",
    "chief_complaint": "follow-up of chronic conditions",
    "medical_history": "reports compliance with medications but notes occasional headaches",
    "bp_systolic": 144,
    "bp_diastolic": 85,
    "temperature_f": 98.5,
    "weight_lbs": 239,
    "heart_rate": 75,
    "vitals_text": "BP 144/85 | Temp 98.5 \u00b0F | Wt 239 lb | HR 75",
    "physical_exam": "no acute distress, heart RRR with no murmurs, lungs clear bilaterally",
    "lab_results": "fasting glucose: 145-165 mg/dL, HbA1c: 7.5-9.0%, LDL 110-140 mg/dL, HDL 35-45 mg/dL",
    "assessment": "Essential hypertension, Type 2 diabetes",
    "icd10_codes": "I10, E11.65",
    "diagnosis_summary": "Essential hypertension, Type 2 diabetes",
    "treatment_plan": "Medications: metformin 1000 mg BID, lisinopril 10-20 mg daily. Follow-up in 16 weeks.",
    "medications_prescribed": "metformin 1000 mg BID, lisinopril 10-20 mg daily",
    "procedures_planned": "",
    "referrals": "",
    "follow_up_weeks": 16,
    "full_clinical_note": "Ashley Sanchez, a 68-year-old female, presents today for follow-up of chronic conditions. The patient reports compliance with medications but notes occasional headaches. Personal, social, and family histories have been reviewed and updated in EMR. BP 144/85 | Temp 98.5 \u00b0F | Wt 239 lb | HR 75. Physical exam reveals no acute distress, heart RRR with no murmurs, lungs clear bilaterally. Labs show fasting glucose: 145-165 mg/dL, HbA1c: 7.5-9.0%, LDL 110-140 mg/dL, HDL 35-45 mg/dL. Assessment: Essential hypertension, Type 2 diabetes (I10, E11.65). Plan: Prescribe metformin 1000 mg BID, and lisinopril 10-20 mg daily. Follow up in 16 weeks.",
    "provider_name": "Dr. Williams",
    "department": "Pulmonology",
    "note_status": "FINAL",
    "created_at": "2025-06-09T01:17:14.909476",
    "updated_at": "2025-06-09T01:17:14.909476"
  },
  {
    "note_id": "NOTE00041",
    "patient_name": "Margaret Jackson",
    "patient_age": 75,
    "patient_gender": "Female",
    "encounter_date": "2025-10-11T01:17:14.909486",
    "encounter_type": "Annual Physical",
    "chief_complaint": "annual physical examination",
    "medical_history": "feels well, exercises regularly, balanced diet, no current complaints",
    "bp_systolic": 114,
    "bp_diastolic": 66,
    "temperature_f": 97.8,
    "weight_lbs": 127,
    "heart_rate": 70,
    "vitals_text": "BP 114/66 | Temp 97.8 \u00b0F | Wt 127 lb | HR 70",
    "physical_exam": "unremarkable, clear lungs, RRR heart sounds, normal neurological function",
    "lab_results": "CBC, CMP, lipid panel within normal limits",
    "assessment": "Health maintenance",
    "icd10_codes": "Z00.00",
    "diagnosis_summary": "Health maintenance",
    "treatment_plan": "Medications: Continue current regimen. Follow-up in 52 weeks.",
    "medications_prescribed": "Continue current regimen",
    "procedures_planned": "",
    "referrals": "",
    "follow_up_weeks": 52,
    "full_clinical_note": "Margaret Jackson, a 75-year-old female, presents today for annual physical examination. The patient feels well, exercises regularly, balanced diet, no current complaints. Personal, social, and family histories have been reviewed and updated in EMR. BP 114/66 | Temp 97.8 \u00b0F | Wt 127 lb | HR 70. Physical exam reveals unremarkable, clear lungs, RRR heart sounds, normal neurological function. Labs show CBC, CMP, lipid panel within normal limits. Assessment: Health maintenance (Z00.00). Plan: Prescribe Continue current regimen. Follow up in 52 weeks.",
    "provider_name": "Dr. Davis",
    "department": "Pulmonology",
    "note_status": "FINAL",
    "created_at": "2025-10-11T01:17:14.909486",
    "updated_at": "2025-10-11T01:17:14.909486"
  },
  {
    "note_id": "NOTE00042",
    "patient_name": "Donna Sanchez",
    "patient_age": 78,
    "patient_gender": "Female",
    "encounter_date": "2024-01-06T01:17:14.909496",
    "encounter_type": "Orthopedic Follow-up",
    "chief_complaint": "chronic knee/hip pain",
    "medical_history": "reports joint pain and stiffness, worse in morning, improves with activity",
    "bp_systolic": 135,
    "bp_diastolic": 86,
    "temperature_f": 97.9,
    "weight_lbs": 220,
    "heart_rate": 74,
    "vitals_text": "BP 135/86 | Temp 97.9 \u00b0F | Wt 220 lb | HR 74",
    "physical_exam": "joint crepitus noted, mild effusion, reduced range of motion, no erythema",
    "lab_results": "X-ray shows joint space narrowing and osteophyte formation",
    "assessment": "Osteoarthritis of knee/hip",
    "icd10_codes": "M17.11, M16.11",
    "diagnosis_summary": "Osteoarthritis of knee/hip",
    "treatment_plan": "Medications: acetaminophen 1000 mg TID, celecoxib 200 mg daily, glucosamine 1500 mg daily. Follow-up in 24 weeks.",
    "medications_prescribed": "acetaminophen 1000 mg TID, celecoxib 200 mg daily, glucosamine 1500 mg daily",
    "procedures_planned": "",
    "referrals": "",
    "follow_up_weeks": 24,
    "full_clinical_note": "Donna Sanchez, a 78-year-old female, presents today for chronic knee/hip pain. The patient reports joint pain and stiffness, worse in morning, improves with activity. Personal, social, and family histories have been reviewed and updated in EMR. BP 135/86 | Temp 97.9 \u00b0F | Wt 220 lb | HR 74. Physical exam reveals joint crepitus noted, mild effusion, reduced range of motion, no erythema. Labs show X-ray shows joint space narrowing and osteophyte formation. Assessment: Osteoarthritis of knee/hip (M17.11, M16.11). Plan: Prescribe acetaminophen 1000 mg TID, celecoxib 200 mg daily, and glucosamine 1500 mg daily. Follow up in 24 weeks.",
    "provider_name": "Dr. Smith",
    "department": "Family Medicine",
    "note_status": "FINAL",
    "created_at": "2024-01-06T01:17:14.909496",
    "updated_at": "2024-01-06T01:17:14.909496"
  },
  {
    "note_id": "NOTE00043",
    "patient_name": "Michelle Rodriguez",
    "patient_age": 66,
    "patient_gender": "Female",
    "encounter_date": "2024-12-24T01:17:14.909506",
    "encounter_type": "Follow-up Visit",
    "chief_complaint": "follow-up of chronic conditions",
    "medical_history": "reports compliance with medications but notes occasional headaches",
    "bp_systolic": 153,
    "bp_diastolic": 85,
    "temperature_f": 97.0,
    "weight_lbs": 239,
    "heart_rate": 77,
    "vitals_text": "BP 153/85 | Temp 97.0 \u00b0F | Wt 239 lb | HR 77",
    "physical_exam": "no acute distress, heart RRR with no murmurs, lungs clear bilaterally",
    "lab_results": "fasting glucose: 145-165 mg/dL, HbA1c: 7.5-9.0%, LDL 110-140 mg/dL, HDL 35-45 mg/dL",
    "assessment": "Essential hypertension, Type 2 diabetes",
    "icd10_codes": "I10, E11.65",
    "diagnosis_summary": "Essential hypertension, Type 2 diabetes",
    "treatment_plan": "Medications: metformin 1000 mg BID, lisinopril 10-20 mg daily. Follow-up in 12 weeks.",
    "medications_prescribed": "metformin 1000 mg BID, lisinopril 10-20 mg daily",
    "procedures_planned": "",
    "referrals": "",
    "follow_up_weeks": 12,
    "full_clinical_note": "Michelle Rodriguez, a 66-year-old female, presents today for follow-up of chronic conditions. The patient reports compliance with medications but notes occasional headaches. Personal, social, and family histories have been reviewed and updated in EMR. BP 153/85 | Temp 97.0 \u00b0F | Wt 239 lb | HR 77. Physical exam reveals no acute distress, heart RRR with no murmurs, lungs clear bilaterally. Labs show fasting glucose: 145-165 mg/dL, HbA1c: 7.5-9.0%, LDL 110-140 mg/dL, HDL 35-45 mg/dL. Assessment: Essential hypertension, Type 2 diabetes (I10, E11.65). Plan: Prescribe metformin 1000 mg BID, and lisinopril 10-20 mg daily. Follow up in 12 weeks.",
    "provider_name": "Dr. Jones",
    "department": "Internal Medicine",
    "note_status": "FINAL",
    "created_at": "2024-12-24T01:17:14.909506",
    "updated_at": "2024-12-24T01:17:14.909506"
  },
  {
    "note_id": "NOTE00044",
    "patient_name": "Donna Martin",
    "patient_age": 41,
    "patient_gender": "Female",
    "encounter_date": "2025-10-04T01:17:14.909516",
    "encounter_type": "Mental Health Follow-up",
    "chief_complaint": "follow-up on anxiety and depression",
    "medical_history": "mentions worsening anxiety episodes triggered by work stress, denies suicidal ideation",
    "bp_systolic": 120,
    "bp_diastolic": 82,
    "temperature_f": 97.5,
    "weight_lbs": 164,
    "heart_rate": 69,
    "vitals_text": "BP 120/82 | Temp 97.5 \u00b0F | Wt 164 lb | HR 69",
    "physical_exam": "no acute distress, engages cooperatively in conversation, appropriate affect",
    "lab_results": "PHQ-9 score: 10-16 (moderate depression), GAD-7 score: 8-12 (mild-moderate anxiety)",
    "assessment": "Major depressive disorder, Generalized anxiety disorder",
    "icd10_codes": "F33.1, F41.1",
    "diagnosis_summary": "Major depressive disorder, Generalized anxiety disorder",
    "treatment_plan": "Medications: sertraline 50-150 mg daily, hydroxyzine 25 mg PRN anxiety, buspirone 15 mg BID. Follow-up in 4 weeks.",
    "medications_prescribed": "sertraline 50-150 mg daily, hydroxyzine 25 mg PRN anxiety, buspirone 15 mg BID",
    "procedures_planned": "",
    "referrals": "",
    "follow_up_weeks": 4,
    "full_clinical_note": "Donna Martin, a 41-year-old female, presents today for follow-up on anxiety and depression. The patient mentions worsening anxiety episodes triggered by work stress, denies suicidal ideation. Personal, social, and family histories have been reviewed and updated in EMR. BP 120/82 | Temp 97.5 \u00b0F | Wt 164 lb | HR 69. Physical exam reveals no acute distress, engages cooperatively in conversation, appropriate affect. Labs show PHQ-9 score: 10-16 (moderate depression), GAD-7 score: 8-12 (mild-moderate anxiety). Assessment: Major depressive disorder, Generalized anxiety disorder (F33.1, F41.1). Plan: Prescribe sertraline 50-150 mg daily, hydroxyzine 25 mg PRN anxiety, and buspirone 15 mg BID. Follow up in 4 weeks.",
    "provider_name": "Dr. Davis",
    "department": "Internal Medicine",
    "note_status": "FINAL",
    "created_at": "2025-10-04T01:17:14.909516",
    "updated_at": "2025-10-04T01:17:14.909516"
  },
  {
    "note_id": "NOTE00045",
    "patient_name": "David Jackson",
    "patient_age": 50,
    "patient_gender": "Male",
    "encounter_date": "2025-07-13T01:17:14.909530",
    "encounter_type": "Follow-up Visit",
    "chief_complaint": "follow-up of chronic conditions",
    "medical_history": "reports compliance with medications but notes occasional headaches",
    "bp_systolic": 149,
    "bp_diastolic": 86,
    "temperature_f": 97.7,
    "weight_lbs": 203,
    "heart_rate": 74,
    "vitals_text": "BP 149/86 | Temp 97.7 \u00b0F | Wt 203 lb | HR 74",
    "physical_exam": "no acute distress, heart RRR with no murmurs, lungs clear bilaterally",
    "lab_results": "fasting glucose: 145-165 mg/dL, HbA1c: 7.5-9.0%, LDL 110-140 mg/dL, HDL 35-45 mg/dL",
    "assessment": "Essential hypertension, Type 2 diabetes",
    "icd10_codes": "I10, E11.65",
    "diagnosis_summary": "Essential hypertension, Type 2 diabetes",
    "treatment_plan": "Medications: lisinopril 10-20 mg daily. Follow-up in 16 weeks.",
    "medications_prescribed": "lisinopril 10-20 mg daily",
    "procedures_planned": "",
    "referrals": "",
    "follow_up_weeks": 16,
    "full_clinical_note": "David Jackson, a 50-year-old male, presents today for follow-up of chronic conditions. The patient reports compliance with medications but notes occasional headaches. Personal, social, and family histories have been reviewed and updated in EMR. BP 149/86 | Temp 97.7 \u00b0F | Wt 203 lb | HR 74. Physical exam reveals no acute distress, heart RRR with no murmurs, lungs clear bilaterally. Labs show fasting glucose: 145-165 mg/dL, HbA1c: 7.5-9.0%, LDL 110-140 mg/dL, HDL 35-45 mg/dL. Assessment: Essential hypertension, Type 2 diabetes (I10, E11.65). Plan: Prescribe lisinopril 10-20 mg daily. Follow up in 16 weeks.",
    "provider_name": "Dr. Brown",
    "department": "Cardiology",
    "note_status": "FINAL",
    "created_at": "2025-07-13T01:17:14.909530",
    "updated_at": "2025-07-13T01:17:14.909530"
  },
  {
    "note_id": "NOTE00046",
    "patient_name": "Nancy Thomas",
    "patient_age": 84,
    "patient_gender": "Female",
    "encounter_date": "2024-05-10T01:17:14.909540",
    "encounter_type": "Cardiopulmonary Follow-up",
    "chief_complaint": "routine follow-up for COPD and heart failure",
    "medical_history": "experiences dyspnea on exertion, denies chest pain, reports mild peripheral edema",
    "bp_systolic": 142,
    "bp_diastolic": 77,
    "temperature_f": 98.2,
    "weight_lbs": 173,
    "heart_rate": 91,
    "vitals_text": "BP 142/77 | Temp 98.2 \u00b0F | Wt 173 lb | HR 91",
    "physical_exam": "bilateral crackles at lung bases, S3 heart sound, mild peripheral edema (+1 to +2)",
    "lab_results": "BNP elevated at 300-450 pg/mL, creatinine stable at 1.0-1.5 mg/dL, oxygen saturation 88-92%",
    "assessment": "CHF exacerbation, COPD",
    "icd10_codes": "I50.9, J44.9",
    "diagnosis_summary": "CHF exacerbation, COPD",
    "treatment_plan": "Medications: carvedilol 12.5 mg BID. Follow-up in 2 weeks.",
    "medications_prescribed": "carvedilol 12.5 mg BID",
    "procedures_planned": "",
    "referrals": "",
    "follow_up_weeks": 2,
    "full_clinical_note": "Nancy Thomas, a 84-year-old female, presents today for routine follow-up for COPD and heart failure. The patient experiences dyspnea on exertion, denies chest pain, reports mild peripheral edema. Personal, social, and family histories have been reviewed and updated in EMR. BP 142/77 | Temp 98.2 \u00b0F | Wt 173 lb | HR 91. Physical exam reveals bilateral crackles at lung bases, S3 heart sound, mild peripheral edema (+1 to +2). Labs show BNP elevated at 300-450 pg/mL, creatinine stable at 1.0-1.5 mg/dL, oxygen saturation 88-92%. Assessment: CHF exacerbation, COPD (I50.9, J44.9). Plan: Prescribe carvedilol 12.5 mg BID. Follow up in 2 weeks.",
    "provider_name": "Dr. Williams",
    "department": "Cardiology",
    "note_status": "FINAL",
    "created_at": "2024-05-10T01:17:14.909540",
    "updated_at": "2024-05-10T01:17:14.909540"
  },
  {
    "note_id": "NOTE00047",
    "patient_name": "Michelle Miller",
    "patient_age": 68,
    "patient_gender": "Female",
    "encounter_date": "2025-09-08T01:17:14.909549",
    "encounter_type": "Cardiopulmonary Follow-up",
    "chief_complaint": "routine follow-up for COPD and heart failure",
    "medical_history": "experiences dyspnea on exertion, denies chest pain, reports mild peripheral edema",
    "bp_systolic": 143,
    "bp_diastolic": 70,
    "temperature_f": 97.7,
    "weight_lbs": 200,
    "heart_rate": 82,
    "vitals_text": "BP 143/70 | Temp 97.7 \u00b0F | Wt 200 lb | HR 82",
    "physical_exam": "bilateral crackles at lung bases, S3 heart sound, mild peripheral edema (+1 to +2)",
    "lab_results": "BNP elevated at 300-450 pg/mL, creatinine stable at 1.0-1.5 mg/dL, oxygen saturation 88-92%",
    "assessment": "CHF exacerbation, COPD",
    "icd10_codes": "I50.9, J44.9",
    "diagnosis_summary": "CHF exacerbation, COPD",
    "treatment_plan": "Medications: tiotropium inhaled daily. Follow-up in 6 weeks.",
    "medications_prescribed": "tiotropium inhaled daily",
    "procedures_planned": "",
    "referrals": "",
    "follow_up_weeks": 6,
    "full_clinical_note": "Michelle Miller, a 68-year-old female, presents today for routine follow-up for COPD and heart failure. The patient experiences dyspnea on exertion, denies chest pain, reports mild peripheral edema. Personal, social, and family histories have been reviewed and updated in EMR. BP 143/70 | Temp 97.7 \u00b0F | Wt 200 lb | HR 82. Physical exam reveals bilateral crackles at lung bases, S3 heart sound, mild peripheral edema (+1 to +2). Labs show BNP elevated at 300-450 pg/mL, creatinine stable at 1.0-1.5 mg/dL, oxygen saturation 88-92%. Assessment: CHF exacerbation, COPD (I50.9, J44.9). Plan: Prescribe tiotropium inhaled daily. Follow up in 6 weeks.",
    "provider_name": "Dr. Jones",
    "department": "Pulmonology",
    "note_status": "FINAL",
    "created_at": "2025-09-08T01:17:14.909549",
    "updated_at": "2025-09-08T01:17:14.909549"
  },
  {
    "note_id": "NOTE00048",
    "patient_name": "Jessica Gonzalez",
    "patient_age": 57,
    "patient_gender": "Female",
    "encounter_date": "2024-02-15T01:17:14.909558",
    "encounter_type": "Pre-operative Visit",
    "chief_complaint": "pre-surgical evaluation",
    "medical_history": "scheduled for elective surgery, no recent illnesses",
    "bp_systolic": 123,
    "bp_diastolic": 78,
    "temperature_f": 98.4,
    "weight_lbs": 113,
    "heart_rate": 85,
    "vitals_text": "BP 123/78 | Temp 98.4 \u00b0F | Wt 113 lb | HR 85",
    "physical_exam": "general health good, cardiovascular and pulmonary systems stable",
    "lab_results": "CBC, CMP, PT/INR within normal limits",
    "assessment": "Pre-operative evaluation",
    "icd10_codes": "Z01.818",
    "diagnosis_summary": "Pre-operative evaluation",
    "treatment_plan": "Medications: Continue home medications, Hold aspirin 7 days prior. Follow-up in 1 weeks.",
    "medications_prescribed": "Continue home medications, Hold aspirin 7 days prior",
    "procedures_planned": "",
    "referrals": "",
    "follow_up_weeks": 1,
    "full_clinical_note": "Jessica Gonzalez, a 57-year-old female, presents today for pre-surgical evaluation. The patient scheduled for elective surgery, no recent illnesses. Personal, social, and family histories have been reviewed and updated in EMR. BP 123/78 | Temp 98.4 \u00b0F | Wt 113 lb | HR 85. Physical exam reveals general health good, cardiovascular and pulmonary systems stable. Labs show CBC, CMP, PT/INR within normal limits. Assessment: Pre-operative evaluation (Z01.818). Plan: Prescribe Continue home medications, and Hold aspirin 7 days prior. Follow up in 1 weeks.",
    "provider_name": "Dr. Brown",
    "department": "Cardiology",
    "note_status": "FINAL",
    "created_at": "2024-02-15T01:17:14.909558",
    "updated_at": "2024-02-15T01:17:14.909558"
  },
  {
    "note_id": "NOTE00049",
    "patient_name": "Thomas Harris",
    "patient_age": 77,
    "patient_gender": "Male",
    "encounter_date": "2025-06-08T01:17:14.909568",
    "encounter_type": "Cardiopulmonary Follow-up",
    "chief_complaint": "routine follow-up for COPD and heart failure",
    "medical_history": "experiences dyspnea on exertion, denies chest pain, reports mild peripheral edema",
    "bp_systolic": 140,
    "bp_diastolic": 78,
    "temperature_f": 98.5,
    "weight_lbs": 178,
    "heart_rate": 90,
    "vitals_text": "BP 140/78 | Temp 98.5 \u00b0F | Wt 178 lb | HR 90",
    "physical_exam": "bilateral crackles at lung bases, S3 heart sound, mild peripheral edema (+1 to +2)",
    "lab_results": "BNP elevated at 300-450 pg/mL, creatinine stable at 1.0-1.5 mg/dL, oxygen saturation 88-92%",
    "assessment": "CHF exacerbation, COPD",
    "icd10_codes": "I50.9, J44.9",
    "diagnosis_summary": "CHF exacerbation, COPD",
    "treatment_plan": "Medications: furosemide 40-80 mg daily, carvedilol 12.5 mg BID. Follow-up in 2 weeks.",
    "medications_prescribed": "furosemide 40-80 mg daily, carvedilol 12.5 mg BID",
    "procedures_planned": "",
    "referrals": "",
    "follow_up_weeks": 2,
    "full_clinical_note": "Thomas Harris, a 77-year-old male, presents today for routine follow-up for COPD and heart failure. The patient experiences dyspnea on exertion, denies chest pain, reports mild peripheral edema. Personal, social, and family histories have been reviewed and updated in EMR. BP 140/78 | Temp 98.5 \u00b0F | Wt 178 lb | HR 90. Physical exam reveals bilateral crackles at lung bases, S3 heart sound, mild peripheral edema (+1 to +2). Labs show BNP elevated at 300-450 pg/mL, creatinine stable at 1.0-1.5 mg/dL, oxygen saturation 88-92%. Assessment: CHF exacerbation, COPD (I50.9, J44.9). Plan: Prescribe furosemide 40-80 mg daily, and carvedilol 12.5 mg BID. Follow up in 2 weeks.",
    "provider_name": "Dr. Smith",
    "department": "Internal Medicine",
    "note_status": "FINAL",
    "created_at": "2025-06-08T01:17:14.909568",
    "updated_at": "2025-06-08T01:17:14.909568"
  },
  {
    "note_id": "NOTE00050",
    "patient_name": "Mark Gonzalez",
    "patient_age": 51,
    "patient_gender": "Male",
    "encounter_date": "2025-10-20T01:17:14.909580",
    "encounter_type": "Pain Management",
    "chief_complaint": "evaluation of chronic back pain",
    "medical_history": "reports pain intensity 5-7/10, exacerbated with prolonged sitting, occasional radiation to leg",
    "bp_systolic": 125,
    "bp_diastolic": 83,
    "temperature_f": 98.0,
    "weight_lbs": 232,
    "heart_rate": 83,
    "vitals_text": "BP 125/83 | Temp 98.0 \u00b0F | Wt 232 lb | HR 83",
    "physical_exam": "neurologically intact, tenderness over lumbar spine, mild restriction in forward flexion",
    "lab_results": "MRI lumbar spine shows L4-L5 or L5-S1 degenerative disc changes",
    "assessment": "Chronic low back pain, lumbar spondylosis",
    "icd10_codes": "M54.5, M47.816",
    "diagnosis_summary": "Chronic low back pain, lumbar spondylosis",
    "treatment_plan": "Medications: meloxicam 15 mg daily, gabapentin 300-600 mg TID. Follow-up in 8 weeks.",
    "medications_prescribed": "meloxicam 15 mg daily, gabapentin 300-600 mg TID",
    "procedures_planned": "",
    "referrals": "",
    "follow_up_weeks": 8,
    "full_clinical_note": "Mark Gonzalez, a 51-year-old male, presents today for evaluation of chronic back pain. The patient reports pain intensity 5-7/10, exacerbated with prolonged sitting, occasional radiation to leg. Personal, social, and family histories have been reviewed and updated in EMR. BP 125/83 | Temp 98.0 \u00b0F | Wt 232 lb | HR 83. Physical exam reveals neurologically intact, tenderness over lumbar spine, mild restriction in forward flexion. Labs show MRI lumbar spine shows L4-L5 or L5-S1 degenerative disc changes. Assessment: Chronic low back pain, lumbar spondylosis (M54.5, M47.816). Plan: Prescribe meloxicam 15 mg daily, and gabapentin 300-600 mg TID. Follow up in 8 weeks.",
    "provider_name": "Dr. Brown",
    "department": "Orthopedics",
    "note_status": "FINAL",
    "created_at": "2025-10-20T01:17:14.909580",
    "updated_at": "2025-10-20T01:17:14.909580"
  },
  {
    "note_id": "NOTE00051",
    "patient_name": "Michelle Lee",
    "patient_age": 59,
    "patient_gender": "Female",
    "encounter_date": "2024-02-21T01:17:14.909610",
    "encounter_type": "Endocrine Follow-up",
    "chief_complaint": "thyroid disorder follow-up",
    "medical_history": "reports fatigue and weight gain, compliant with thyroid medication",
    "bp_systolic": 130,
    "bp_diastolic": 78,
    "temperature_f": 97.1,
    "weight_lbs": 177,
    "heart_rate": 74,
    "vitals_text": "BP 130/78 | Temp 97.1 \u00b0F | Wt 177 lb | HR 74",
    "physical_exam": "thyroid non-palpable, no nodules, normal cardiovascular exam",
    "lab_results": "TSH: 5.5-8.5 mIU/L, Free T4: 0.7-0.9 ng/dL",
    "assessment": "Hypothyroidism",
    "icd10_codes": "E03.9",
    "diagnosis_summary": "Hypothyroidism",
    "treatment_plan": "Medications: levothyroxine 75-125 mcg daily. Follow-up in 16 weeks.",
    "medications_prescribed": "levothyroxine 75-125 mcg daily",
    "procedures_planned": "",
    "referrals": "",
    "follow_up_weeks": 16,
    "full_clinical_note": "Michelle Lee, a 59-year-old female, presents today for thyroid disorder follow-up. The patient reports fatigue and weight gain, compliant with thyroid medication. Personal, social, and family histories have been reviewed and updated in EMR. BP 130/78 | Temp 97.1 \u00b0F | Wt 177 lb | HR 74. Physical exam reveals thyroid non-palpable, no nodules, normal cardiovascular exam. Labs show TSH: 5.5-8.5 mIU/L, Free T4: 0.7-0.9 ng/dL. Assessment: Hypothyroidism (E03.9). Plan: Prescribe levothyroxine 75-125 mcg daily. Follow up in 16 weeks.",
    "provider_name": "Dr. Jones",
    "department": "Pulmonology",
    "note_status": "FINAL",
    "created_at": "2024-02-21T01:17:14.909610",
    "updated_at": "2024-02-21T01:17:14.909610"
  },
  {
    "note_id": "NOTE00052",
    "patient_name": "Steven Harris",
    "patient_age": 52,
    "patient_gender": "Male",
    "encounter_date": "2024-10-23T01:17:14.909621",
    "encounter_type": "Pain Management",
    "chief_complaint": "evaluation of chronic back pain",
    "medical_history": "reports pain intensity 5-7/10, exacerbated with prolonged sitting, occasional radiation to leg",
    "bp_systolic": 130,
    "bp_diastolic": 83,
    "temperature_f": 98.3,
    "weight_lbs": 202,
    "heart_rate": 80,
    "vitals_text": "BP 130/83 | Temp 98.3 \u00b0F | Wt 202 lb | HR 80",
    "physical_exam": "neurologically intact, tenderness over lumbar spine, mild restriction in forward flexion",
    "lab_results": "MRI lumbar spine shows L4-L5 or L5-S1 degenerative disc changes",
    "assessment": "Chronic low back pain, lumbar spondylosis",
    "icd10_codes": "M54.5, M47.816",
    "diagnosis_summary": "Chronic low back pain, lumbar spondylosis",
    "treatment_plan": "Medications: gabapentin 300-600 mg TID, meloxicam 15 mg daily, cyclobenzaprine 10 mg TID PRN. Follow-up in 6 weeks.",
    "medications_prescribed": "gabapentin 300-600 mg TID, meloxicam 15 mg daily, cyclobenzaprine 10 mg TID PRN",
    "procedures_planned": "",
    "referrals": "",
    "follow_up_weeks": 6,
    "full_clinical_note": "Steven Harris, a 52-year-old male, presents today for evaluation of chronic back pain. The patient reports pain intensity 5-7/10, exacerbated with prolonged sitting, occasional radiation to leg. Personal, social, and family histories have been reviewed and updated in EMR. BP 130/83 | Temp 98.3 \u00b0F | Wt 202 lb | HR 80. Physical exam reveals neurologically intact, tenderness over lumbar spine, mild restriction in forward flexion. Labs show MRI lumbar spine shows L4-L5 or L5-S1 degenerative disc changes. Assessment: Chronic low back pain, lumbar spondylosis (M54.5, M47.816). Plan: Prescribe gabapentin 300-600 mg TID, meloxicam 15 mg daily, and cyclobenzaprine 10 mg TID PRN. Follow up in 6 weeks.",
    "provider_name": "Dr. Johnson",
    "department": "Family Medicine",
    "note_status": "FINAL",
    "created_at": "2024-10-23T01:17:14.909621",
    "updated_at": "2024-10-23T01:17:14.909621"
  },
  {
    "note_id": "NOTE00053",
    "patient_name": "Betty Taylor",
    "patient_age": 51,
    "patient_gender": "Female",
    "encounter_date": "2025-02-06T01:17:14.909633",
    "encounter_type": "Follow-up Visit",
    "chief_complaint": "follow-up of chronic conditions",
    "medical_history": "reports compliance with medications but notes occasional headaches",
    "bp_systolic": 141,
    "bp_diastolic": 88,
    "temperature_f": 98.4,
    "weight_lbs": 204,
    "heart_rate": 83,
    "vitals_text": "BP 141/88 | Temp 98.4 \u00b0F | Wt 204 lb | HR 83",
    "physical_exam": "no acute distress, heart RRR with no murmurs, lungs clear bilaterally",
    "lab_results": "fasting glucose: 145-165 mg/dL, HbA1c: 7.5-9.0%, LDL 110-140 mg/dL, HDL 35-45 mg/dL",
    "assessment": "Essential hypertension, Type 2 diabetes",
    "icd10_codes": "I10, E11.65",
    "diagnosis_summary": "Essential hypertension, Type 2 diabetes",
    "treatment_plan": "Medications: lisinopril 10-20 mg daily. Follow-up in 12 weeks.",
    "medications_prescribed": "lisinopril 10-20 mg daily",
    "procedures_planned": "",
    "referrals": "",
    "follow_up_weeks": 12,
    "full_clinical_note": "Betty Taylor, a 51-year-old female, presents today for follow-up of chronic conditions. The patient reports compliance with medications but notes occasional headaches. Personal, social, and family histories have been reviewed and updated in EMR. BP 141/88 | Temp 98.4 \u00b0F | Wt 204 lb | HR 83. Physical exam reveals no acute distress, heart RRR with no murmurs, lungs clear bilaterally. Labs show fasting glucose: 145-165 mg/dL, HbA1c: 7.5-9.0%, LDL 110-140 mg/dL, HDL 35-45 mg/dL. Assessment: Essential hypertension, Type 2 diabetes (I10, E11.65). Plan: Prescribe lisinopril 10-20 mg daily. Follow up in 12 weeks.",
    "provider_name": "Dr. Davis",
    "department": "Cardiology",
    "note_status": "FINAL",
    "created_at": "2025-02-06T01:17:14.909633",
    "updated_at": "2025-02-06T01:17:14.909633"
  },
  {
    "note_id": "NOTE00054",
    "patient_name": "James Miller",
    "patient_age": 63,
    "patient_gender": "Male",
    "encounter_date": "2024-03-20T01:17:14.909643",
    "encounter_type": "Annual Physical",
    "chief_complaint": "annual physical examination",
    "medical_history": "feels well, exercises regularly, balanced diet, no current complaints",
    "bp_systolic": 130,
    "bp_diastolic": 66,
    "temperature_f": 98.2,
    "weight_lbs": 171,
    "heart_rate": 69,
    "vitals_text": "BP 130/66 | Temp 98.2 \u00b0F | Wt 171 lb | HR 69",
    "physical_exam": "unremarkable, clear lungs, RRR heart sounds, normal neurological function",
    "lab_results": "CBC, CMP, lipid panel within normal limits",
    "assessment": "Health maintenance",
    "icd10_codes": "Z00.00",
    "diagnosis_summary": "Health maintenance",
    "treatment_plan": "Medications: Continue current regimen. Follow-up in 52 weeks.",
    "medications_prescribed": "Continue current regimen",
    "procedures_planned": "",
    "referrals": "",
    "follow_up_weeks": 52,
    "full_clinical_note": "James Miller, a 63-year-old male, presents today for annual physical examination. The patient feels well, exercises regularly, balanced diet, no current complaints. Personal, social, and family histories have been reviewed and updated in EMR. BP 130/66 | Temp 98.2 \u00b0F | Wt 171 lb | HR 69. Physical exam reveals unremarkable, clear lungs, RRR heart sounds, normal neurological function. Labs show CBC, CMP, lipid panel within normal limits. Assessment: Health maintenance (Z00.00). Plan: Prescribe Continue current regimen. Follow up in 52 weeks.",
    "provider_name": "Dr. Smith",
    "department": "Orthopedics",
    "note_status": "FINAL",
    "created_at": "2024-03-20T01:17:14.909643",
    "updated_at": "2024-03-20T01:17:14.909643"
  },
  {
    "note_id": "NOTE00055",
    "patient_name": "Thomas Brown",
    "patient_age": 39,
    "patient_gender": "Male",
    "encounter_date": "2024-11-10T01:17:14.909653",
    "encounter_type": "Pre-operative Visit",
    "chief_complaint": "pre-surgical evaluation",
    "medical_history": "scheduled for elective surgery, no recent illnesses",
    "bp_systolic": 127,
    "bp_diastolic": 71,
    "temperature_f": 98.3,
    "weight_lbs": 199,
    "heart_rate": 89,
    "vitals_text": "BP 127/71 | Temp 98.3 \u00b0F | Wt 199 lb | HR 89",
    "physical_exam": "general health good, cardiovascular and pulmonary systems stable",
    "lab_results": "CBC, CMP, PT/INR within normal limits",
    "assessment": "Pre-operative evaluation",
    "icd10_codes": "Z01.818",
    "diagnosis_summary": "Pre-operative evaluation",
    "treatment_plan": "Medications: Continue home medications, Hold aspirin 7 days prior. Follow-up in 2 weeks.",
    "medications_prescribed": "Continue home medications, Hold aspirin 7 days prior",
    "procedures_planned": "",
    "referrals": "",
    "follow_up_weeks": 2,
    "full_clinical_note": "Thomas Brown, a 39-year-old male, presents today for pre-surgical evaluation. The patient scheduled for elective surgery, no recent illnesses. Personal, social, and family histories have been reviewed and updated in EMR. BP 127/71 | Temp 98.3 \u00b0F | Wt 199 lb | HR 89. Physical exam reveals general health good, cardiovascular and pulmonary systems stable. Labs show CBC, CMP, PT/INR within normal limits. Assessment: Pre-operative evaluation (Z01.818). Plan: Prescribe Continue home medications, and Hold aspirin 7 days prior. Follow up in 2 weeks.",
    "provider_name": "Dr. Williams",
    "department": "Pulmonology",
    "note_status": "FINAL",
    "created_at": "2024-11-10T01:17:14.909653",
    "updated_at": "2024-11-10T01:17:14.909653"
  },
  {
    "note_id": "NOTE00056",
    "patient_name": "Jennifer Ramirez",
    "patient_age": 75,
    "patient_gender": "Female",
    "encounter_date": "2025-04-22T01:17:14.909662",
    "encounter_type": "Cardiopulmonary Follow-up",
    "chief_complaint": "routine follow-up for COPD and heart failure",
    "medical_history": "experiences dyspnea on exertion, denies chest pain, reports mild peripheral edema",
    "bp_systolic": 138,
    "bp_diastolic": 76,
    "temperature_f": 97.9,
    "weight_lbs": 187,
    "heart_rate": 99,
    "vitals_text": "BP 138/76 | Temp 97.9 \u00b0F | Wt 187 lb | HR 99",
    "physical_exam": "bilateral crackles at lung bases, S3 heart sound, mild peripheral edema (+1 to +2)",
    "lab_results": "BNP elevated at 300-450 pg/mL, creatinine stable at 1.0-1.5 mg/dL, oxygen saturation 88-92%",
    "assessment": "CHF exacerbation, COPD",
    "icd10_codes": "I50.9, J44.9",
    "diagnosis_summary": "CHF exacerbation, COPD",
    "treatment_plan": "Medications: carvedilol 12.5 mg BID. Follow-up in 4 weeks.",
    "medications_prescribed": "carvedilol 12.5 mg BID",
    "procedures_planned": "",
    "referrals": "",
    "follow_up_weeks": 4,
    "full_clinical_note": "Jennifer Ramirez, a 75-year-old female, presents today for routine follow-up for COPD and heart failure. The patient experiences dyspnea on exertion, denies chest pain, reports mild peripheral edema. Personal, social, and family histories have been reviewed and updated in EMR. BP 138/76 | Temp 97.9 \u00b0F | Wt 187 lb | HR 99. Physical exam reveals bilateral crackles at lung bases, S3 heart sound, mild peripheral edema (+1 to +2). Labs show BNP elevated at 300-450 pg/mL, creatinine stable at 1.0-1.5 mg/dL, oxygen saturation 88-92%. Assessment: CHF exacerbation, COPD (I50.9, J44.9). Plan: Prescribe carvedilol 12.5 mg BID. Follow up in 4 weeks.",
    "provider_name": "Dr. Smith",
    "department": "Internal Medicine",
    "note_status": "FINAL",
    "created_at": "2025-04-22T01:17:14.909662",
    "updated_at": "2025-04-22T01:17:14.909662"
  },
  {
    "note_id": "NOTE00057",
    "patient_name": "Donald Robinson",
    "patient_age": 23,
    "patient_gender": "Male",
    "encounter_date": "2024-02-07T01:17:14.909672",
    "encounter_type": "Neurology Follow-up",
    "chief_complaint": "recurrent migraine headaches",
    "medical_history": "reports 3-5 headaches per month, photophobia and nausea with attacks",
    "bp_systolic": 124,
    "bp_diastolic": 72,
    "temperature_f": 98.2,
    "weight_lbs": 150,
    "heart_rate": 66,
    "vitals_text": "BP 124/72 | Temp 98.2 \u00b0F | Wt 150 lb | HR 66",
    "physical_exam": "neurological exam normal, no focal deficits",
    "lab_results": "No labs indicated, clinical diagnosis",
    "assessment": "Migraine without aura",
    "icd10_codes": "G43.009",
    "diagnosis_summary": "Migraine without aura",
    "treatment_plan": "Medications: topiramate 50 mg BID. Follow-up in 12 weeks.",
    "medications_prescribed": "topiramate 50 mg BID",
    "procedures_planned": "",
    "referrals": "",
    "follow_up_weeks": 12,
    "full_clinical_note": "Donald Robinson, a 23-year-old male, presents today for recurrent migraine headaches. The patient reports 3-5 headaches per month, photophobia and nausea with attacks. Personal, social, and family histories have been reviewed and updated in EMR. BP 124/72 | Temp 98.2 \u00b0F | Wt 150 lb | HR 66. Physical exam reveals neurological exam normal, no focal deficits. Assessment: Migraine without aura (G43.009). Plan: Prescribe topiramate 50 mg BID. Follow up in 12 weeks.",
    "provider_name": "Dr. Johnson",
    "department": "Orthopedics",
    "note_status": "FINAL",
    "created_at": "2024-02-07T01:17:14.909672",
    "updated_at": "2024-02-07T01:17:14.909672"
  },
  {
    "note_id": "NOTE00058",
    "patient_name": "Sandra Wilson",
    "patient_age": 50,
    "patient_gender": "Female",
    "encounter_date": "2024-06-03T01:17:14.909681",
    "encounter_type": "Neurology Follow-up",
    "chief_complaint": "recurrent migraine headaches",
    "medical_history": "reports 3-5 headaches per month, photophobia and nausea with attacks",
    "bp_systolic": 116,
    "bp_diastolic": 72,
    "temperature_f": 98.1,
    "weight_lbs": 180,
    "heart_rate": 73,
    "vitals_text": "BP 116/72 | Temp 98.1 \u00b0F | Wt 180 lb | HR 73",
    "physical_exam": "neurological exam normal, no focal deficits",
    "lab_results": "No labs indicated, clinical diagnosis",
    "assessment": "Migraine without aura",
    "icd10_codes": "G43.009",
    "diagnosis_summary": "Migraine without aura",
    "treatment_plan": "Medications: sumatriptan 100 mg PRN, topiramate 50 mg BID, propranolol 80 mg daily. Follow-up in 16 weeks.",
    "medications_prescribed": "sumatriptan 100 mg PRN, topiramate 50 mg BID, propranolol 80 mg daily",
    "procedures_planned": "",
    "referrals": "",
    "follow_up_weeks": 16,
    "full_clinical_note": "Sandra Wilson, a 50-year-old female, presents today for recurrent migraine headaches. The patient reports 3-5 headaches per month, photophobia and nausea with attacks. Personal, social, and family histories have been reviewed and updated in EMR. BP 116/72 | Temp 98.1 \u00b0F | Wt 180 lb | HR 73. Physical exam reveals neurological exam normal, no focal deficits. Assessment: Migraine without aura (G43.009). Plan: Prescribe sumatriptan 100 mg PRN, topiramate 50 mg BID, and propranolol 80 mg daily. Follow up in 16 weeks.",
    "provider_name": "Dr. Smith",
    "department": "Internal Medicine",
    "note_status": "FINAL",
    "created_at": "2024-06-03T01:17:14.909681",
    "updated_at": "2024-06-03T01:17:14.909681"
  },
  {
    "note_id": "NOTE00059",
    "patient_name": "Elizabeth Thomas",
    "patient_age": 63,
    "patient_gender": "Female",
    "encounter_date": "2024-09-10T01:17:14.909692",
    "encounter_type": "Pain Management",
    "chief_complaint": "evaluation of chronic back pain",
    "medical_history": "reports pain intensity 5-7/10, exacerbated with prolonged sitting, occasional radiation to leg",
    "bp_systolic": 145,
    "bp_diastolic": 75,
    "temperature_f": 98.6,
    "weight_lbs": 265,
    "heart_rate": 74,
    "vitals_text": "BP 145/75 | Temp 98.6 \u00b0F | Wt 265 lb | HR 74",
    "physical_exam": "neurologically intact, tenderness over lumbar spine, mild restriction in forward flexion",
    "lab_results": "MRI lumbar spine shows L4-L5 or L5-S1 degenerative disc changes",
    "assessment": "Chronic low back pain, lumbar spondylosis",
    "icd10_codes": "M54.5, M47.816",
    "diagnosis_summary": "Chronic low back pain, lumbar spondylosis",
    "treatment_plan": "Medications: meloxicam 15 mg daily, cyclobenzaprine 10 mg TID PRN, gabapentin 300-600 mg TID. Follow-up in 8 weeks.",
    "medications_prescribed": "meloxicam 15 mg daily, cyclobenzaprine 10 mg TID PRN, gabapentin 300-600 mg TID",
    "procedures_planned": "",
    "referrals": "",
    "follow_up_weeks": 8,
    "full_clinical_note": "Elizabeth Thomas, a 63-year-old female, presents today for evaluation of chronic back pain. The patient reports pain intensity 5-7/10, exacerbated with prolonged sitting, occasional radiation to leg. Personal, social, and family histories have been reviewed and updated in EMR. BP 145/75 | Temp 98.6 \u00b0F | Wt 265 lb | HR 74. Physical exam reveals neurologically intact, tenderness over lumbar spine, mild restriction in forward flexion. Labs show MRI lumbar spine shows L4-L5 or L5-S1 degenerative disc changes. Assessment: Chronic low back pain, lumbar spondylosis (M54.5, M47.816). Plan: Prescribe meloxicam 15 mg daily, cyclobenzaprine 10 mg TID PRN, and gabapentin 300-600 mg TID. Follow up in 8 weeks.",
    "provider_name": "Dr. Davis",
    "department": "Internal Medicine",
    "note_status": "FINAL",
    "created_at": "2024-09-10T01:17:14.909692",
    "updated_at": "2024-09-10T01:17:14.909692"
  },
  {
    "note_id": "NOTE00060",
    "patient_name": "Robert Smith",
    "patient_age": 60,
    "patient_gender": "Male",
    "encounter_date": "2025-04-10T01:17:14.909703",
    "encounter_type": "Pre-operative Visit",
    "chief_complaint": "pre-surgical evaluation",
    "medical_history": "scheduled for elective surgery, no recent illnesses",
    "bp_systolic": 115,
    "bp_diastolic": 82,
    "temperature_f": 97.5,
    "weight_lbs": 135,
    "heart_rate": 81,
    "vitals_text": "BP 115/82 | Temp 97.5 \u00b0F | Wt 135 lb | HR 81",
    "physical_exam": "general health good, cardiovascular and pulmonary systems stable",
    "lab_results": "CBC, CMP, PT/INR within normal limits",
    "assessment": "Pre-operative evaluation",
    "icd10_codes": "Z01.818",
    "diagnosis_summary": "Pre-operative evaluation",
    "treatment_plan": "Medications: Continue home medications. Follow-up in 1 weeks.",
    "medications_prescribed": "Continue home medications",
    "procedures_planned": "",
    "referrals": "",
    "follow_up_weeks": 1,
    "full_clinical_note": "Robert Smith, a 60-year-old male, presents today for pre-surgical evaluation. The patient scheduled for elective surgery, no recent illnesses. Personal, social, and family histories have been reviewed and updated in EMR. BP 115/82 | Temp 97.5 \u00b0F | Wt 135 lb | HR 81. Physical exam reveals general health good, cardiovascular and pulmonary systems stable. Labs show CBC, CMP, PT/INR within normal limits. Assessment: Pre-operative evaluation (Z01.818). Plan: Prescribe Continue home medications. Follow up in 1 weeks.",
    "provider_name": "Dr. Williams",
    "department": "Internal Medicine",
    "note_status": "FINAL",
    "created_at": "2025-04-10T01:17:14.909703",
    "updated_at": "2025-04-10T01:17:14.909703"
  },
  {
    "note_id": "NOTE00061",
    "patient_name": "Matthew Harris",
    "patient_age": 75,
    "patient_gender": "Male",
    "encounter_date": "2024-05-06T01:17:14.909713",
    "encounter_type": "Cardiopulmonary Follow-up",
    "chief_complaint": "routine follow-up for COPD and heart failure",
    "medical_history": "experiences dyspnea on exertion, denies chest pain, reports mild peripheral edema",
    "bp_systolic": 145,
    "bp_diastolic": 79,
    "temperature_f": 98.1,
    "weight_lbs": 161,
    "heart_rate": 81,
    "vitals_text": "BP 145/79 | Temp 98.1 \u00b0F | Wt 161 lb | HR 81",
    "physical_exam": "bilateral crackles at lung bases, S3 heart sound, mild peripheral edema (+1 to +2)",
    "lab_results": "BNP elevated at 300-450 pg/mL, creatinine stable at 1.0-1.5 mg/dL, oxygen saturation 88-92%",
    "assessment": "CHF exacerbation, COPD",
    "icd10_codes": "I50.9, J44.9",
    "diagnosis_summary": "CHF exacerbation, COPD",
    "treatment_plan": "Medications: tiotropium inhaled daily, carvedilol 12.5 mg BID. Follow-up in 6 weeks.",
    "medications_prescribed": "tiotropium inhaled daily, carvedilol 12.5 mg BID",
    "procedures_planned": "",
    "referrals": "",
    "follow_up_weeks": 6,
    "full_clinical_note": "Matthew Harris, a 75-year-old male, presents today for routine follow-up for COPD and heart failure. The patient experiences dyspnea on exertion, denies chest pain, reports mild peripheral edema. Personal, social, and family histories have been reviewed and updated in EMR. BP 145/79 | Temp 98.1 \u00b0F | Wt 161 lb | HR 81. Physical exam reveals bilateral crackles at lung bases, S3 heart sound, mild peripheral edema (+1 to +2). Labs show BNP elevated at 300-450 pg/mL, creatinine stable at 1.0-1.5 mg/dL, oxygen saturation 88-92%. Assessment: CHF exacerbation, COPD (I50.9, J44.9). Plan: Prescribe tiotropium inhaled daily, and carvedilol 12.5 mg BID. Follow up in 6 weeks.",
    "provider_name": "Dr. Smith",
    "department": "Pulmonology",
    "note_status": "FINAL",
    "created_at": "2024-05-06T01:17:14.909713",
    "updated_at": "2024-05-06T01:17:14.909713"
  },
  {
    "note_id": "NOTE00062",
    "patient_name": "Betty Williams",
    "patient_age": 37,
    "patient_gender": "Female",
    "encounter_date": "2024-05-11T01:17:14.909726",
    "encounter_type": "Pain Management",
    "chief_complaint": "evaluation of chronic back pain",
    "medical_history": "reports pain intensity 5-7/10, exacerbated with prolonged sitting, occasional radiation to leg",
    "bp_systolic": 126,
    "bp_diastolic": 75,
    "temperature_f": 97.8,
    "weight_lbs": 218,
    "heart_rate": 83,
    "vitals_text": "BP 126/75 | Temp 97.8 \u00b0F | Wt 218 lb | HR 83",
    "physical_exam": "neurologically intact, tenderness over lumbar spine, mild restriction in forward flexion",
    "lab_results": "MRI lumbar spine shows L4-L5 or L5-S1 degenerative disc changes",
    "assessment": "Chronic low back pain, lumbar spondylosis",
    "icd10_codes": "M54.5, M47.816",
    "diagnosis_summary": "Chronic low back pain, lumbar spondylosis",
    "treatment_plan": "Medications: cyclobenzaprine 10 mg TID PRN, gabapentin 300-600 mg TID, meloxicam 15 mg daily. Follow-up in 8 weeks.",
    "medications_prescribed": "cyclobenzaprine 10 mg TID PRN, gabapentin 300-600 mg TID, meloxicam 15 mg daily",
    "procedures_planned": "",
    "referrals": "",
    "follow_up_weeks": 8,
    "full_clinical_note": "Betty Williams, a 37-year-old female, presents today for evaluation of chronic back pain. The patient reports pain intensity 5-7/10, exacerbated with prolonged sitting, occasional radiation to leg. Personal, social, and family histories have been reviewed and updated in EMR. BP 126/75 | Temp 97.8 \u00b0F | Wt 218 lb | HR 83. Physical exam reveals neurologically intact, tenderness over lumbar spine, mild restriction in forward flexion. Labs show MRI lumbar spine shows L4-L5 or L5-S1 degenerative disc changes. Assessment: Chronic low back pain, lumbar spondylosis (M54.5, M47.816). Plan: Prescribe cyclobenzaprine 10 mg TID PRN, gabapentin 300-600 mg TID, and meloxicam 15 mg daily. Follow up in 8 weeks.",
    "provider_name": "Dr. Smith",
    "department": "Cardiology",
    "note_status": "FINAL",
    "created_at": "2024-05-11T01:17:14.909726",
    "updated_at": "2024-05-11T01:17:14.909726"
  },
  {
    "note_id": "NOTE00063",
    "patient_name": "David Garcia",
    "patient_age": 35,
    "patient_gender": "Male",
    "encounter_date": "2025-05-31T01:17:14.909743",
    "encounter_type": "Neurology Follow-up",
    "chief_complaint": "recurrent migraine headaches",
    "medical_history": "reports 3-5 headaches per month, photophobia and nausea with attacks",
    "bp_systolic": 128,
    "bp_diastolic": 73,
    "temperature_f": 97.9,
    "weight_lbs": 171,
    "heart_rate": 78,
    "vitals_text": "BP 128/73 | Temp 97.9 \u00b0F | Wt 171 lb | HR 78",
    "physical_exam": "neurological exam normal, no focal deficits",
    "lab_results": "No labs indicated, clinical diagnosis",
    "assessment": "Migraine without aura",
    "icd10_codes": "G43.009",
    "diagnosis_summary": "Migraine without aura",
    "treatment_plan": "Medications: topiramate 50 mg BID, propranolol 80 mg daily. Follow-up in 8 weeks.",
    "medications_prescribed": "topiramate 50 mg BID, propranolol 80 mg daily",
    "procedures_planned": "",
    "referrals": "",
    "follow_up_weeks": 8,
    "full_clinical_note": "David Garcia, a 35-year-old male, presents today for recurrent migraine headaches. The patient reports 3-5 headaches per month, photophobia and nausea with attacks. Personal, social, and family histories have been reviewed and updated in EMR. BP 128/73 | Temp 97.9 \u00b0F | Wt 171 lb | HR 78. Physical exam reveals neurological exam normal, no focal deficits. Assessment: Migraine without aura (G43.009). Plan: Prescribe topiramate 50 mg BID, and propranolol 80 mg daily. Follow up in 8 weeks.",
    "provider_name": "Dr. Johnson",
    "department": "Cardiology",
    "note_status": "FINAL",
    "created_at": "2025-05-31T01:17:14.909743",
    "updated_at": "2025-05-31T01:17:14.909743"
  },
  {
    "note_id": "NOTE00064",
    "patient_name": "James Wilson",
    "patient_age": 34,
    "patient_gender": "Male",
    "encounter_date": "2025-10-07T01:17:14.909754",
    "encounter_type": "Pulmonary Follow-up",
    "chief_complaint": "follow-up for asthma management",
    "medical_history": "reports occasional wheezing during colds, uses rescue inhaler 2-3 times per week",
    "bp_systolic": 125,
    "bp_diastolic": 77,
    "temperature_f": 98.3,
    "weight_lbs": 136,
    "heart_rate": 71,
    "vitals_text": "BP 125/77 | Temp 98.3 \u00b0F | Wt 136 lb | HR 71",
    "physical_exam": "lung auscultation reveals occasional expiratory wheezes, no respiratory distress",
    "lab_results": "Peak flow: 75-85% of predicted, spirometry shows mild obstruction",
    "assessment": "Moderate persistent asthma",
    "icd10_codes": "J45.40",
    "diagnosis_summary": "Moderate persistent asthma",
    "treatment_plan": "Medications: fluticasone/salmeterol 250/50 mcg BID. Follow-up in 12 weeks.",
    "medications_prescribed": "fluticasone/salmeterol 250/50 mcg BID",
    "procedures_planned": "",
    "referrals": "",
    "follow_up_weeks": 12,
    "full_clinical_note": "James Wilson, a 34-year-old male, presents today for follow-up for asthma management. The patient reports occasional wheezing during colds, uses rescue inhaler 2-3 times per week. Personal, social, and family histories have been reviewed and updated in EMR. BP 125/77 | Temp 98.3 \u00b0F | Wt 136 lb | HR 71. Physical exam reveals lung auscultation reveals occasional expiratory wheezes, no respiratory distress. Labs show Peak flow: 75-85% of predicted, spirometry shows mild obstruction. Assessment: Moderate persistent asthma (J45.40). Plan: Prescribe fluticasone/salmeterol 250/50 mcg BID. Follow up in 12 weeks.",
    "provider_name": "Dr. Smith",
    "department": "Cardiology",
    "note_status": "FINAL",
    "created_at": "2025-10-07T01:17:14.909754",
    "updated_at": "2025-10-07T01:17:14.909754"
  },
  {
    "note_id": "NOTE00065",
    "patient_name": "Donald White",
    "patient_age": 35,
    "patient_gender": "Male",
    "encounter_date": "2024-08-10T01:17:14.909764",
    "encounter_type": "Pre-operative Visit",
    "chief_complaint": "pre-surgical evaluation",
    "medical_history": "scheduled for elective surgery, no recent illnesses",
    "bp_systolic": 136,
    "bp_diastolic": 68,
    "temperature_f": 97.9,
    "weight_lbs": 147,
    "heart_rate": 70,
    "vitals_text": "BP 136/68 | Temp 97.9 \u00b0F | Wt 147 lb | HR 70",
    "physical_exam": "general health good, cardiovascular and pulmonary systems stable",
    "lab_results": "CBC, CMP, PT/INR within normal limits",
    "assessment": "Pre-operative evaluation",
    "icd10_codes": "Z01.818",
    "diagnosis_summary": "Pre-operative evaluation",
    "treatment_plan": "Medications: Continue home medications, Hold aspirin 7 days prior. Follow-up in 2 weeks.",
    "medications_prescribed": "Continue home medications, Hold aspirin 7 days prior",
    "procedures_planned": "",
    "referrals": "",
    "follow_up_weeks": 2,
    "full_clinical_note": "Donald White, a 35-year-old male, presents today for pre-surgical evaluation. The patient scheduled for elective surgery, no recent illnesses. Personal, social, and family histories have been reviewed and updated in EMR. BP 136/68 | Temp 97.9 \u00b0F | Wt 147 lb | HR 70. Physical exam reveals general health good, cardiovascular and pulmonary systems stable. Labs show CBC, CMP, PT/INR within normal limits. Assessment: Pre-operative evaluation (Z01.818). Plan: Prescribe Continue home medications, and Hold aspirin 7 days prior. Follow up in 2 weeks.",
    "provider_name": "Dr. Davis",
    "department": "Orthopedics",
    "note_status": "FINAL",
    "created_at": "2024-08-10T01:17:14.909764",
    "updated_at": "2024-08-10T01:17:14.909764"
  },
  {
    "note_id": "NOTE00066",
    "patient_name": "Thomas Anderson",
    "patient_age": 34,
    "patient_gender": "Male",
    "encounter_date": "2024-08-22T01:17:14.909774",
    "encounter_type": "Mental Health Follow-up",
    "chief_complaint": "follow-up on anxiety and depression",
    "medical_history": "mentions worsening anxiety episodes triggered by work stress, denies suicidal ideation",
    "bp_systolic": 120,
    "bp_diastolic": 70,
    "temperature_f": 97.9,
    "weight_lbs": 133,
    "heart_rate": 67,
    "vitals_text": "BP 120/70 | Temp 97.9 \u00b0F | Wt 133 lb | HR 67",
    "physical_exam": "no acute distress, engages cooperatively in conversation, appropriate affect",
    "lab_results": "PHQ-9 score: 10-16 (moderate depression), GAD-7 score: 8-12 (mild-moderate anxiety)",
    "assessment": "Major depressive disorder, Generalized anxiety disorder",
    "icd10_codes": "F33.1, F41.1",
    "diagnosis_summary": "Major depressive disorder, Generalized anxiety disorder",
    "treatment_plan": "Medications: hydroxyzine 25 mg PRN anxiety. Follow-up in 4 weeks.",
    "medications_prescribed": "hydroxyzine 25 mg PRN anxiety",
    "procedures_planned": "",
    "referrals": "",
    "follow_up_weeks": 4,
    "full_clinical_note": "Thomas Anderson, a 34-year-old male, presents today for follow-up on anxiety and depression. The patient mentions worsening anxiety episodes triggered by work stress, denies suicidal ideation. Personal, social, and family histories have been reviewed and updated in EMR. BP 120/70 | Temp 97.9 \u00b0F | Wt 133 lb | HR 67. Physical exam reveals no acute distress, engages cooperatively in conversation, appropriate affect. Labs show PHQ-9 score: 10-16 (moderate depression), GAD-7 score: 8-12 (mild-moderate anxiety). Assessment: Major depressive disorder, Generalized anxiety disorder (F33.1, F41.1). Plan: Prescribe hydroxyzine 25 mg PRN anxiety. Follow up in 4 weeks.",
    "provider_name": "Dr. Brown",
    "department": "Orthopedics",
    "note_status": "FINAL",
    "created_at": "2024-08-22T01:17:14.909774",
    "updated_at": "2024-08-22T01:17:14.909774"
  },
  {
    "note_id": "NOTE00067",
    "patient_name": "Matthew Smith",
    "patient_age": 15,
    "patient_gender": "Male",
    "encounter_date": "2023-11-29T01:17:14.909784",
    "encounter_type": "Pulmonary Follow-up",
    "chief_complaint": "follow-up for asthma management",
    "medical_history": "reports occasional wheezing during colds, uses rescue inhaler 2-3 times per week",
    "bp_systolic": 118,
    "bp_diastolic": 70,
    "temperature_f": 97.6,
    "weight_lbs": 148,
    "heart_rate": 92,
    "vitals_text": "BP 118/70 | Temp 97.6 \u00b0F | Wt 148 lb | HR 92",
    "physical_exam": "lung auscultation reveals occasional expiratory wheezes, no respiratory distress",
    "lab_results": "Peak flow: 75-85% of predicted, spirometry shows mild obstruction",
    "assessment": "Moderate persistent asthma",
    "icd10_codes": "J45.40",
    "diagnosis_summary": "Moderate persistent asthma",
    "treatment_plan": "Medications: albuterol inhaler PRN. Follow-up in 16 weeks.",
    "medications_prescribed": "albuterol inhaler PRN",
    "procedures_planned": "",
    "referrals": "",
    "follow_up_weeks": 16,
    "full_clinical_note": "Matthew Smith, a 15-year-old male, presents today for follow-up for asthma management. The patient reports occasional wheezing during colds, uses rescue inhaler 2-3 times per week. Personal, social, and family histories have been reviewed and updated in EMR. BP 118/70 | Temp 97.6 \u00b0F | Wt 148 lb | HR 92. Physical exam reveals lung auscultation reveals occasional expiratory wheezes, no respiratory distress. Labs show Peak flow: 75-85% of predicted, spirometry shows mild obstruction. Assessment: Moderate persistent asthma (J45.40). Plan: Prescribe albuterol inhaler PRN. Follow up in 16 weeks.",
    "provider_name": "Dr. Johnson",
    "department": "Family Medicine",
    "note_status": "FINAL",
    "created_at": "2023-11-29T01:17:14.909784",
    "updated_at": "2023-11-29T01:17:14.909784"
  },
  {
    "note_id": "NOTE00068",
    "patient_name": "Daniel Martin",
    "patient_age": 41,
    "patient_gender": "Male",
    "encounter_date": "2025-05-26T01:17:14.909793",
    "encounter_type": "Pre-operative Visit",
    "chief_complaint": "pre-surgical evaluation",
    "medical_history": "scheduled for elective surgery, no recent illnesses",
    "bp_systolic": 135,
    "bp_diastolic": 83,
    "temperature_f": 98.2,
    "weight_lbs": 155,
    "heart_rate": 87,
    "vitals_text": "BP 135/83 | Temp 98.2 \u00b0F | Wt 155 lb | HR 87",
    "physical_exam": "general health good, cardiovascular and pulmonary systems stable",
    "lab_results": "CBC, CMP, PT/INR within normal limits",
    "assessment": "Pre-operative evaluation",
    "icd10_codes": "Z01.818",
    "diagnosis_summary": "Pre-operative evaluation",
    "treatment_plan": "Medications: Hold aspirin 7 days prior. Follow-up in 1 weeks.",
    "medications_prescribed": "Hold aspirin 7 days prior",
    "procedures_planned": "",
    "referrals": "",
    "follow_up_weeks": 1,
    "full_clinical_note": "Daniel Martin, a 41-year-old male, presents today for pre-surgical evaluation. The patient scheduled for elective surgery, no recent illnesses. Personal, social, and family histories have been reviewed and updated in EMR. BP 135/83 | Temp 98.2 \u00b0F | Wt 155 lb | HR 87. Physical exam reveals general health good, cardiovascular and pulmonary systems stable. Labs show CBC, CMP, PT/INR within normal limits. Assessment: Pre-operative evaluation (Z01.818). Plan: Prescribe Hold aspirin 7 days prior. Follow up in 1 weeks.",
    "provider_name": "Dr. Smith",
    "department": "Pulmonology",
    "note_status": "FINAL",
    "created_at": "2025-05-26T01:17:14.909793",
    "updated_at": "2025-05-26T01:17:14.909793"
  },
  {
    "note_id": "NOTE00069",
    "patient_name": "Andrew Clark",
    "patient_age": 7,
    "patient_gender": "Male",
    "encounter_date": "2025-07-24T01:17:14.909804",
    "encounter_type": "Pre-operative Visit",
    "chief_complaint": "pre-surgical evaluation",
    "medical_history": "scheduled for elective surgery, no recent illnesses",
    "bp_systolic": 139,
    "bp_diastolic": 79,
    "temperature_f": 98.0,
    "weight_lbs": 141,
    "heart_rate": 83,
    "vitals_text": "BP 139/79 | Temp 98.0 \u00b0F | Wt 141 lb | HR 83",
    "physical_exam": "general health good, cardiovascular and pulmonary systems stable",
    "lab_results": "CBC, CMP, PT/INR within normal limits",
    "assessment": "Pre-operative evaluation",
    "icd10_codes": "Z01.818",
    "diagnosis_summary": "Pre-operative evaluation",
    "treatment_plan": "Medications: Continue home medications. Follow-up in 2 weeks.",
    "medications_prescribed": "Continue home medications",
    "procedures_planned": "",
    "referrals": "",
    "follow_up_weeks": 2,
    "full_clinical_note": "Andrew Clark, a 7-year-old male, presents today for pre-surgical evaluation. The patient scheduled for elective surgery, no recent illnesses. Personal, social, and family histories have been reviewed and updated in EMR. BP 139/79 | Temp 98.0 \u00b0F | Wt 141 lb | HR 83. Physical exam reveals general health good, cardiovascular and pulmonary systems stable. Labs show CBC, CMP, PT/INR within normal limits. Assessment: Pre-operative evaluation (Z01.818). Plan: Prescribe Continue home medications. Follow up in 2 weeks.",
    "provider_name": "Dr. Johnson",
    "department": "Pulmonology",
    "note_status": "FINAL",
    "created_at": "2025-07-24T01:17:14.909804",
    "updated_at": "2025-07-24T01:17:14.909804"
  },
  {
    "note_id": "NOTE00070",
    "patient_name": "Richard Williams",
    "patient_age": 32,
    "patient_gender": "Male",
    "encounter_date": "2025-04-23T01:17:14.909815",
    "encounter_type": "Mental Health Follow-up",
    "chief_complaint": "follow-up on anxiety and depression",
    "medical_history": "mentions worsening anxiety episodes triggered by work stress, denies suicidal ideation",
    "bp_systolic": 116,
    "bp_diastolic": 75,
    "temperature_f": 98.0,
    "weight_lbs": 127,
    "heart_rate": 67,
    "vitals_text": "BP 116/75 | Temp 98.0 \u00b0F | Wt 127 lb | HR 67",
    "physical_exam": "no acute distress, engages cooperatively in conversation, appropriate affect",
    "lab_results": "PHQ-9 score: 10-16 (moderate depression), GAD-7 score: 8-12 (mild-moderate anxiety)",
    "assessment": "Major depressive disorder, Generalized anxiety disorder",
    "icd10_codes": "F33.1, F41.1",
    "diagnosis_summary": "Major depressive disorder, Generalized anxiety disorder",
    "treatment_plan": "Medications: buspirone 15 mg BID, hydroxyzine 25 mg PRN anxiety, sertraline 50-150 mg daily. Follow-up in 8 weeks.",
    "medications_prescribed": "buspirone 15 mg BID, hydroxyzine 25 mg PRN anxiety, sertraline 50-150 mg daily",
    "procedures_planned": "",
    "referrals": "",
    "follow_up_weeks": 8,
    "full_clinical_note": "Richard Williams, a 32-year-old male, presents today for follow-up on anxiety and depression. The patient mentions worsening anxiety episodes triggered by work stress, denies suicidal ideation. Personal, social, and family histories have been reviewed and updated in EMR. BP 116/75 | Temp 98.0 \u00b0F | Wt 127 lb | HR 67. Physical exam reveals no acute distress, engages cooperatively in conversation, appropriate affect. Labs show PHQ-9 score: 10-16 (moderate depression), GAD-7 score: 8-12 (mild-moderate anxiety). Assessment: Major depressive disorder, Generalized anxiety disorder (F33.1, F41.1). Plan: Prescribe buspirone 15 mg BID, hydroxyzine 25 mg PRN anxiety, and sertraline 50-150 mg daily. Follow up in 8 weeks.",
    "provider_name": "Dr. Brown",
    "department": "Pulmonology",
    "note_status": "FINAL",
    "created_at": "2025-04-23T01:17:14.909815",
    "updated_at": "2025-04-23T01:17:14.909815"
  },
  {
    "note_id": "NOTE00071",
    "patient_name": "John Jackson",
    "patient_age": 54,
    "patient_gender": "Male",
    "encounter_date": "2024-02-06T01:17:14.909825",
    "encounter_type": "Pain Management",
    "chief_complaint": "evaluation of chronic back pain",
    "medical_history": "reports pain intensity 5-7/10, exacerbated with prolonged sitting, occasional radiation to leg",
    "bp_systolic": 127,
    "bp_diastolic": 77,
    "temperature_f": 98.3,
    "weight_lbs": 241,
    "heart_rate": 79,
    "vitals_text": "BP 127/77 | Temp 98.3 \u00b0F | Wt 241 lb | HR 79",
    "physical_exam": "neurologically intact, tenderness over lumbar spine, mild restriction in forward flexion",
    "lab_results": "MRI lumbar spine shows L4-L5 or L5-S1 degenerative disc changes",
    "assessment": "Chronic low back pain, lumbar spondylosis",
    "icd10_codes": "M54.5, M47.816",
    "diagnosis_summary": "Chronic low back pain, lumbar spondylosis",
    "treatment_plan": "Medications: cyclobenzaprine 10 mg TID PRN, gabapentin 300-600 mg TID. Follow-up in 6 weeks.",
    "medications_prescribed": "cyclobenzaprine 10 mg TID PRN, gabapentin 300-600 mg TID",
    "procedures_planned": "",
    "referrals": "",
    "follow_up_weeks": 6,
    "full_clinical_note": "John Jackson, a 54-year-old male, presents today for evaluation of chronic back pain. The patient reports pain intensity 5-7/10, exacerbated with prolonged sitting, occasional radiation to leg. Personal, social, and family histories have been reviewed and updated in EMR. BP 127/77 | Temp 98.3 \u00b0F | Wt 241 lb | HR 79. Physical exam reveals neurologically intact, tenderness over lumbar spine, mild restriction in forward flexion. Labs show MRI lumbar spine shows L4-L5 or L5-S1 degenerative disc changes. Assessment: Chronic low back pain, lumbar spondylosis (M54.5, M47.816). Plan: Prescribe cyclobenzaprine 10 mg TID PRN, and gabapentin 300-600 mg TID. Follow up in 6 weeks.",
    "provider_name": "Dr. Williams",
    "department": "Cardiology",
    "note_status": "FINAL",
    "created_at": "2024-02-06T01:17:14.909825",
    "updated_at": "2024-02-06T01:17:14.909825"
  },
  {
    "note_id": "NOTE00072",
    "patient_name": "Donald Lee",
    "patient_age": 65,
    "patient_gender": "Male",
    "encounter_date": "2024-03-02T01:17:14.909835",
    "encounter_type": "Orthopedic Follow-up",
    "chief_complaint": "chronic knee/hip pain",
    "medical_history": "reports joint pain and stiffness, worse in morning, improves with activity",
    "bp_systolic": 132,
    "bp_diastolic": 87,
    "temperature_f": 97.8,
    "weight_lbs": 205,
    "heart_rate": 73,
    "vitals_text": "BP 132/87 | Temp 97.8 \u00b0F | Wt 205 lb | HR 73",
    "physical_exam": "joint crepitus noted, mild effusion, reduced range of motion, no erythema",
    "lab_results": "X-ray shows joint space narrowing and osteophyte formation",
    "assessment": "Osteoarthritis of knee/hip",
    "icd10_codes": "M17.11, M16.11",
    "diagnosis_summary": "Osteoarthritis of knee/hip",
    "treatment_plan": "Medications: celecoxib 200 mg daily. Follow-up in 24 weeks.",
    "medications_prescribed": "celecoxib 200 mg daily",
    "procedures_planned": "",
    "referrals": "",
    "follow_up_weeks": 24,
    "full_clinical_note": "Donald Lee, a 65-year-old male, presents today for chronic knee/hip pain. The patient reports joint pain and stiffness, worse in morning, improves with activity. Personal, social, and family histories have been reviewed and updated in EMR. BP 132/87 | Temp 97.8 \u00b0F | Wt 205 lb | HR 73. Physical exam reveals joint crepitus noted, mild effusion, reduced range of motion, no erythema. Labs show X-ray shows joint space narrowing and osteophyte formation. Assessment: Osteoarthritis of knee/hip (M17.11, M16.11). Plan: Prescribe celecoxib 200 mg daily. Follow up in 24 weeks.",
    "provider_name": "Dr. Williams",
    "department": "Orthopedics",
    "note_status": "FINAL",
    "created_at": "2024-03-02T01:17:14.909835",
    "updated_at": "2024-03-02T01:17:14.909835"
  },
  {
    "note_id": "NOTE00073",
    "patient_name": "Barbara Garcia",
    "patient_age": 60,
    "patient_gender": "Female",
    "encounter_date": "2024-08-12T01:17:14.909844",
    "encounter_type": "Endocrine Follow-up",
    "chief_complaint": "thyroid disorder follow-up",
    "medical_history": "reports fatigue and weight gain, compliant with thyroid medication",
    "bp_systolic": 121,
    "bp_diastolic": 79,
    "temperature_f": 97.4,
    "weight_lbs": 153,
    "heart_rate": 71,
    "vitals_text": "BP 121/79 | Temp 97.4 \u00b0F | Wt 153 lb | HR 71",
    "physical_exam": "thyroid non-palpable, no nodules, normal cardiovascular exam",
    "lab_results": "TSH: 5.5-8.5 mIU/L, Free T4: 0.7-0.9 ng/dL",
    "assessment": "Hypothyroidism",
    "icd10_codes": "E03.9",
    "diagnosis_summary": "Hypothyroidism",
    "treatment_plan": "Medications: levothyroxine 75-125 mcg daily. Follow-up in 16 weeks.",
    "medications_prescribed": "levothyroxine 75-125 mcg daily",
    "procedures_planned": "",
    "referrals": "",
    "follow_up_weeks": 16,
    "full_clinical_note": "Barbara Garcia, a 60-year-old female, presents today for thyroid disorder follow-up. The patient reports fatigue and weight gain, compliant with thyroid medication. Personal, social, and family histories have been reviewed and updated in EMR. BP 121/79 | Temp 97.4 \u00b0F | Wt 153 lb | HR 71. Physical exam reveals thyroid non-palpable, no nodules, normal cardiovascular exam. Labs show TSH: 5.5-8.5 mIU/L, Free T4: 0.7-0.9 ng/dL. Assessment: Hypothyroidism (E03.9). Plan: Prescribe levothyroxine 75-125 mcg daily. Follow up in 16 weeks.",
    "provider_name": "Dr. Johnson",
    "department": "Cardiology",
    "note_status": "FINAL",
    "created_at": "2024-08-12T01:17:14.909844",
    "updated_at": "2024-08-12T01:17:14.909844"
  },
  {
    "note_id": "NOTE00074",
    "patient_name": "Mary Rodriguez",
    "patient_age": 39,
    "patient_gender": "Female",
    "encounter_date": "2024-09-13T01:17:14.909856",
    "encounter_type": "Pulmonary Follow-up",
    "chief_complaint": "follow-up for asthma management",
    "medical_history": "reports occasional wheezing during colds, uses rescue inhaler 2-3 times per week",
    "bp_systolic": 109,
    "bp_diastolic": 74,
    "temperature_f": 98.2,
    "weight_lbs": 114,
    "heart_rate": 87,
    "vitals_text": "BP 109/74 | Temp 98.2 \u00b0F | Wt 114 lb | HR 87",
    "physical_exam": "lung auscultation reveals occasional expiratory wheezes, no respiratory distress",
    "lab_results": "Peak flow: 75-85% of predicted, spirometry shows mild obstruction",
    "assessment": "Moderate persistent asthma",
    "icd10_codes": "J45.40",
    "diagnosis_summary": "Moderate persistent asthma",
    "treatment_plan": "Medications: albuterol inhaler PRN, montelukast 10 mg daily. Follow-up in 12 weeks.",
    "medications_prescribed": "albuterol inhaler PRN, montelukast 10 mg daily",
    "procedures_planned": "",
    "referrals": "",
    "follow_up_weeks": 12,
    "full_clinical_note": "Mary Rodriguez, a 39-year-old female, presents today for follow-up for asthma management. The patient reports occasional wheezing during colds, uses rescue inhaler 2-3 times per week. Personal, social, and family histories have been reviewed and updated in EMR. BP 109/74 | Temp 98.2 \u00b0F | Wt 114 lb | HR 87. Physical exam reveals lung auscultation reveals occasional expiratory wheezes, no respiratory distress. Labs show Peak flow: 75-85% of predicted, spirometry shows mild obstruction. Assessment: Moderate persistent asthma (J45.40). Plan: Prescribe albuterol inhaler PRN, and montelukast 10 mg daily. Follow up in 12 weeks.",
    "provider_name": "Dr. Smith",
    "department": "Pulmonology",
    "note_status": "FINAL",
    "created_at": "2024-09-13T01:17:14.909856",
    "updated_at": "2024-09-13T01:17:14.909856"
  },
  {
    "note_id": "NOTE00075",
    "patient_name": "Ashley Wilson",
    "patient_age": 35,
    "patient_gender": "Female",
    "encounter_date": "2024-02-06T01:17:14.909868",
    "encounter_type": "Annual Physical",
    "chief_complaint": "annual physical examination",
    "medical_history": "feels well, exercises regularly, balanced diet, no current complaints",
    "bp_systolic": 113,
    "bp_diastolic": 66,
    "temperature_f": 98.6,
    "weight_lbs": 121,
    "heart_rate": 79,
    "vitals_text": "BP 113/66 | Temp 98.6 \u00b0F | Wt 121 lb | HR 79",
    "physical_exam": "unremarkable, clear lungs, RRR heart sounds, normal neurological function",
    "lab_results": "CBC, CMP, lipid panel within normal limits",
    "assessment": "Health maintenance",
    "icd10_codes": "Z00.00",
    "diagnosis_summary": "Health maintenance",
    "treatment_plan": "Medications: Continue current regimen. Follow-up in 52 weeks.",
    "medications_prescribed": "Continue current regimen",
    "procedures_planned": "",
    "referrals": "",
    "follow_up_weeks": 52,
    "full_clinical_note": "Ashley Wilson, a 35-year-old female, presents today for annual physical examination. The patient feels well, exercises regularly, balanced diet, no current complaints. Personal, social, and family histories have been reviewed and updated in EMR. BP 113/66 | Temp 98.6 \u00b0F | Wt 121 lb | HR 79. Physical exam reveals unremarkable, clear lungs, RRR heart sounds, normal neurological function. Labs show CBC, CMP, lipid panel within normal limits. Assessment: Health maintenance (Z00.00). Plan: Prescribe Continue current regimen. Follow up in 52 weeks.",
    "provider_name": "Dr. Johnson",
    "department": "Internal Medicine",
    "note_status": "FINAL",
    "created_at": "2024-02-06T01:17:14.909868",
    "updated_at": "2024-02-06T01:17:14.909868"
  }
]